topic,source,author,title,description,content,published_at,url
shipping,[Removed],,[Removed],[Removed],[Removed],2024-11-27T19:50:52Z,https://removed.com
shipping,Wired,Molly Higgins,Exclusive Shed Rain Coupon: 15% Off,"For a limited time, get 15% off stylish and functional umbrellas with our exclusive Shed Rain discount code. Find other great deals like this at WIRED.","If theres one thing Portlanders know, its rain. Since founder Meyer Blauer stepped outside on a typical Pacific Northwest rainy day in Portland in 1947, Shed Rain has stayed committed to making exper… [+1884 chars]",2024-12-04T07:00:00Z,https://www.wired.com/story/shed-rain-coupon/
shipping,CNET,Clifford Colby,"Holiday Shipping Guide: Your Last-Minute Dates for USPS, FedEx, UPS and Amazon","Need to send that last-minute holiday gift? You've still got time for Christmas, Hanukkah and Kwanzaa deliveries.","Doing some last-minute shopping? Don't wait. As of today, you still have time to ship your gifts so they'll arrive before Christmas, Hanukkah and Kwanzaa. You're going to need to act quickly, though.… [+5757 chars]",2024-12-14T23:00:08Z,https://www.cnet.com/home/holiday-shipping-guide-your-last-minute-dates-for-usps-fedex-ups-and-amazon/
shipping,[Removed],,[Removed],[Removed],[Removed],2024-12-03T16:22:16Z,https://removed.com
shipping,Business Insider,Jordan Hart,Here's how long you have left to mail gifts before the holidays,Holiday shipping deadlines are fast approaching for consumers who want their gifts to arrive in time for Christmas. Here are the details.,"Postal workers are doing their part to ensure your packages arrive in time for the holidays.Frederic J. Brown/AFP via Getty Images
<ul><li>Americans should send packages early to meet holiday shippi… [+2241 chars]",2024-12-14T11:08:02Z,https://www.businessinsider.com/holiday-shipping-deadlines-for-ups-fedex-usps-2024-12
shipping,The Verge,Andrew Liszewski,This cheaper Apple Pencil alternative now has tilt detection and a better tip,"The SonarPen 2, which doesn’t need to be charged since it relies on sound instead of Bluetooth, adds tilt detection and an improved replaceable tip.","This cheaper Apple Pencil alternative now has tilt detection and a better tip
This cheaper Apple Pencil alternative now has tilt detection and a better tip
 / The SonarPen 2 still relies on sound w… [+1869 chars]",2024-11-22T15:50:15Z,https://www.theverge.com/2024/11/22/24303122/sonarpen-2-stylus-apple-ipad-pencil
shipping,Wired,Martin Cizmar,Airweave Advanced Mattress Review: A Firm Feel With Extraordinary Airflow,Woven polyethylene looks like tangled fishing line but delivers superior airflow for a firm mattress.,"I've slept on dozens of different mattresses over the past two years while testing beds for our guide to the best mattresses you can buy online, but nothing quite like the Airwave Advanced. I first h… [+2842 chars]",2024-11-21T21:28:16Z,https://www.wired.com/review/airweave-advanced-mattress/
shipping,Wired,Boone Ashworth,Amazon Is Now Selling Hyundai Vehicles Through Amazon Autos,"Amazon’s partnership with Hyundai means you can use the e-retailer to purchase a brand-new car online. More manufacturers will be joining the new service, called Amazon Autos, next year.","The next time you see a Hyundai online, you may just be able to hit Add to Cart.
Assuming you want a new Hyundai specifically, you can now buy the car on Amazon. The online retailer has launched its… [+2867 chars]",2024-12-10T14:00:00Z,https://www.wired.com/story/buy-a-car-on-amazon-hyundai/
shipping,Business Insider,Hannah Abraham,Some ships are adding thousands of miles to journeys to avoid the threat of Houthi attacks off Yemen,"The Houthi threat in the Red Sea and Gulf of Aden means some shipping companies are diverting ships around Africa, increasing costs significantly.","Houthi attacks in the Red Sea have included oil tankers like the Greek-flagged Sounion.Houthi Military Media/Reuters
<ul><li>Container ships are avoiding the threat of Houthi attacks in the Red Sea,… [+2104 chars]",2024-12-11T12:55:58Z,https://www.businessinsider.com/ships-diverting-africa-avoid-houthi-attacks-red-sea-gulf-iran-2024-12
shipping,NPR,The Associated Press,Pakistan ends lockdown of its capital after dispersing Imran Khan supporters,The operation came hours after thousands of Khan supporters broke through a barrier of shipping containers blocking off Islamabad and clashed with security forces.,"ISLAMABAD Authorities reopened roads linking Pakistan's capital with the rest of the country, ending a four-day lockdown, on Wednesday after using tear gas and firing into the air to disperse support… [+1279 chars]",2024-11-27T08:54:42Z,https://www.npr.org/2024/11/27/nx-s1-5207863/pakistan-imran-khan-protests
shipping,Wired,Brenda Stolyar,Nomad Discount Codes and Deals: 50% Off | November 2024,"Get up to 50% off cases, watch bands, and chargers at Nomad Goods this November. Save with verified discounts in November 2024.","At WIRED, we recommend a bunch of Nomad accessories for a variety of gadgets, such as your smartphone, tablet, earbuds, and smartwatch. But it can get expensiveits the price you pay for luxury. If yo… [+2592 chars]",2024-11-20T07:40:00Z,https://www.wired.com/story/nomad-discount-code/
shipping,Business Insider,"Huileng Tan,Theron Mohamed",What Trump's trade plans mean for industry in Canada and Mexico — from oil to autos,"Mexico and Canada are two of America's biggest trading partners, shipping everything from energy and vehicles to machinery and electronics to the US.","Donald Trump announced higher tariffs for Canadian, Mexican, and Chinese exports.Kamil Krzaczynski/AFP via Getty Images
<ul><li>Donald Trump said he would impose 25% tariffs on Canadian and Mexican … [+3452 chars]",2024-11-26T12:14:11Z,https://www.businessinsider.com/trump-trade-tariff-exports-canada-mexico-oil-autos-electronics-machinery-2024-11
shipping,CNET,Jesse Orrall,Gathering Hurricane Data From Inside the Storm video,"These ocean buoys are thrown out of a plane into the path of a hurricane to weather the storm and gather critical data to help create forecasts, coordinate storm response, and make ocean shipping safer and more efficient.",,2024-12-03T13:00:03Z,https://www.cnet.com/videos/gathering-hurricane-data-from-inside-the-storm/
shipping,Gizmodo.com,Cheryl Eddy,"Move Over, Popcorn Bucket: Nosferatu‘s Sarcophagus Is Now a $20,000 Bed You Can Buy",Robert Eggers' vampire tale hits theaters on Christmas—but this lavish piece of tie-in furniture is available for order now.,Still looking for the perfect gift for the goth in your life who has everything? Or perhaps you’ve been searching for a bed that will double as both conversation piece and nightmare fodder? Look no f… [+1992 chars],2024-12-09T18:51:17Z,https://gizmodo.com/move-over-popcorn-bucket-nosferatus-sarcophagus-is-now-a-20000-bed-you-can-buy-2000536045
shipping,BBC News,,Thousands defy Pakistan police in support of Imran Khan,The jailed former leader is calling on the protesters to stay in Islamabad until their demands are met.,"Thousands of opposition protesters have converged on Pakistan's heavily-barricaded capital, demanding the release of jailed former prime minister Imran Khan.
The convoy - which is aiming for a squar… [+1699 chars]",2024-11-26T07:36:22Z,https://www.bbc.com/news/articles/cg7gklm0r04o
shipping,CNET,Amber Guetebier,This Exclusive Code Will Save You More Than 50% Off Select Dreame Robot Vacuums Right Now,"Amazon has an array of Dreame robot vacuums on sale and our exclusive code can increase your savings, just in time for the holidays.","True confession: I detest vacuuming. However, like the average household with pets and kids, it's a necessary -- albeit boring -- evil. Throw on some noise-canceling headphones with my favorite music… [+1569 chars]",2024-12-13T17:28:00Z,https://www.cnet.com/deals/this-exclusive-offer-code-will-save-you-more-than-50-on-select-dreame-vacuums-right-now/
shipping,BBC News,,Behind the scenes of the Baltimore bridge collapse,A new BBC documentary reveals new details of the probe into the Dali's collision with the Key Bridge.,"An estimated 3,000 to 4,000 tonnes of debris from the Francis Scott Key Bridge blocked the Patapsco's shipping channel and pinned down the M/V Dali for months
In the dark, early morning hours of 26 … [+5549 chars]",2024-12-05T06:04:03Z,https://www.bbc.com/news/articles/c1wjvy1gje7o
shipping,Business Insider,Jake Epstein,"Russia's engagement with the Houthis as they lob missiles at ships is getting 'serious,' US official says",The US Special Envoy for Yemen told Business Insider that Russia could make the Houthis even more dangerous to ships sailing nearby routes.,"A screenshot captured from a video released by the Houthis in June shows that a missile launched from an undisclosed desert area in Yemen.Xinhua News Agency/Xinhua News Agency via Getty Images
<ul><… [+4085 chars]",2024-11-18T20:24:57Z,https://www.businessinsider.com/russia-engaging-houthis-serious-level-red-sea-attacks-us-official-2024-11
shipping,Yahoo Entertainment,Cheyenne MacDonald,You can now get a yellow charging brick for $5 to match your Playdate’s cable,"As spotted by a Reddit
 user this weekend, Panic is now selling a macaroni yellow charging brick to go with the yellow cable that comes with the distinctively yellow Playdate. Say yellow again. The good news for anyone who wants a complete set of matching ac…","If you click 'Accept all', we and our partners, including 237 who are part of the IAB Transparency &amp; Consent Framework, will also store and/or access information on a device (in other words, use … [+678 chars]",2024-12-08T22:03:16Z,https://consent.yahoo.com/v2/collectConsent?sessionId=1_cc-session_9d23c6f6-2c38-4777-9204-4a878ce2acef
shipping,CNET,Anna Gragert,"EcoFlow's Rapid Wireless Power Bank Is at a New Low Price, but Only for the Next 10 Hours","With its Qi2 15-watt wireless charging technology, this power bank has the ability to charge your devices two times faster, now for a new low price.","If you're on the go and need a simple way to charge your phone, look no further than this Black Friday deal on the 5,000-mAh EcoFlow Rapid Magnetic Power Bank. For the next 10 hours, the device is $3… [+1803 chars]",2024-11-25T22:48:02Z,https://www.cnet.com/deals/ecoflows-rapid-wireless-power-bank-is-at-a-new-low-price-but-only-for-the-next-10-hours/
shipping,[Removed],,[Removed],[Removed],[Removed],2024-12-01T19:35:15Z,https://removed.com
shipping,Gizmodo.com,Todd Feathers,"Amazon Deceived Black D.C. Neighborhoods With Slower Deliveries, City Alleges","Washington, D.C.'s attorney general has sued the retail giant for charging residents of two zip codes the same Prime price for significantly slower delivery speeds.","Amazon tricked customers in two predominantly Black zip codes in Washington, D.C. into paying for its faster Prime delivery service while actually outsourcing deliveries to slower providers, accordin… [+3000 chars]",2024-12-04T16:15:47Z,https://gizmodo.com/amazon-deceived-black-d-c-neighborhoods-with-slower-deliveries-city-alleges-2000534067
shipping,Gizmodo.com,Kyle Barr,You Can Now Use Uber to Harass Neighbors by Sending Carolers to Their Door,"Uber is re-upping its Christmas tree delivery service, but this year’s festivities also include a door-to-door amateur chorus.","Imagine your home, enjoying the sounds of the crackling fire with your family in companionable silence, when bam, the sudden sound of carolers at the door rips you from your reverie. Ubers latest sam… [+2450 chars]",2024-12-05T19:25:03Z,https://gizmodo.com/you-can-now-use-uber-to-harass-neighbors-by-sending-carolers-to-their-door-2000534793
shipping,BBC News,,Zombie knife surrender policy had 'huge flaws',"Some owners may have been offered more in compensation than their blades were worth, the BBC finds.","The model of knife known as k-mach-165 was among thousands of blades surrendered by a wholesaler in Luton
The Home Office underestimated how many zombie knives and machetes would be surrendered ahea… [+6173 chars]",2024-11-20T05:32:50Z,https://www.bbc.com/news/articles/cpvzkvm3wmno
shipping,Business Insider,"dbrzezinski@businessinsider.com (Dylan Brzezinski,Ju Shardlow,Cynthia Liu)","How arms trafficking actually works, according to a former arms dealer",David Packouz worked at AEY with Efraim Diveroli. He was part of a cover-up to disguise the Chinese origin of ammunition the US gave to Afghanistan.,"David Packouz is a former arms trader. In 2005, he joined the arms dealer Efraim Diveroli at AEY, bidding on contracts for the US military. In 2007, AEY won a $300 million contract to supply munition… [+1226 chars]",2024-12-05T16:58:01Z,https://www.businessinsider.com/how-arms-trafficking-actually-works-2024-12
shipping,MacRumors,Tim Hardwick,AirPods to Be Made in India for the First Time Next Year,"Apple will begin making AirPods in India for the first time early next year, reports Bloomberg. Foxconn will make the wireless earphones at a factory near Hyderabad in Telangana state, beginning around Q1 2025.





The factory has reportedly been making AirP…","Apple will begin making AirPods in India for the first time early next year, reports Bloomberg. Foxconn will make the wireless earphones at a factory near Hyderabad in Telangana state, beginning arou… [+1352 chars]",2024-12-13T12:07:37Z,https://www.macrumors.com/2024/12/13/airpods-made-in-india-from-next-year/
shipping,Polygon,Rowan Zeoli,Tariffs could make you pay more for Kickstarter games you already backed,"As Polygon reported earlier this month, President-elect Donald Trump’s plans to impose tariffs on international sellers could significantly impact game designers — but they could also make you spend more on games you’ve already bought. If you’re an active mem…","As Polygon reported earlier this month, President-elect Donald Trump’s plans to impose tariffs on international sellers could significantly impact game designers — but they could also make you spend … [+2852 chars]",2024-12-05T19:45:02Z,https://www.polygon.com/tabletop-games/491112/trump-tariffs-kickstarter-backerkit-gamefound-crowdfunding
shipping,CNET,Anna Gragert,The DJI Osmo Mobile 6 Smartphone Gimbal Is $50 Off During Cyber Week,"Create the best smartphone photos and videos with the multifaceted DJI Osmo Mobile 6 gimbal, available at the lowest price we've seen this year.","The DJI Osmo Mobile 6 isn't your average smartphone gimbal. Yes, it can hold and stabilize your smartphone, but it can also do much more. Now, thanks to B&amp;H's Cyber Week deals, the gimbal is $50 … [+2409 chars]",2024-12-03T16:04:00Z,https://www.cnet.com/deals/the-dji-osmo-mobile-6-smartphone-gimbal-is-50-off-during-cyber-week/
shipping,Yahoo Entertainment,Steve Dent,LG unveils its own 480Hz OLED gaming monitor,"Back in January at the Consumer Electronics Show (CES), LG unveiled a 27-inch 480Hz OLED panel with some incredible specs, but didn't say when or even if it would build a monitor around it. Now, the company has announced the UltraGear GX7 (27GX790A), a 27-inc…","If you click 'Accept all', we and our partners, including 237 who are part of the IAB Transparency &amp; Consent Framework, will also store and/or access information on a device (in other words, use … [+678 chars]",2024-11-18T13:19:24Z,https://consent.yahoo.com/v2/collectConsent?sessionId=1_cc-session_d13b9208-2e33-4ac7-acb5-9d838a2186e7
shipping,Wired,Julian Chokkattu,Branch Cyber Monday Sale (2024): Deals on Office Chairs,The Branch Cyber Monday Sale has kicked off and runs through December 2. You can get the best deals on our top office chair and standing desk recommendations.,"The Branch Cyber Monday sales event is live and runs through December 2. It's become one of my favorite home office furniture companies for three main reasons. First, its products are easy to assembl… [+6567 chars]",2024-12-02T09:50:07Z,https://www.wired.com/story/branch-cyber-monday-sale-2024/
shipping,ABC News,Max Zahn,"Trump backs dockworkers' fight against automation. He risks price hikes, experts say","Automation causes ""distress, hurt, and harm"" for U.S. workers, Trump says.","President-elect Donald Trump this week voiced support for tens of thousands of unionized dockworkers in a dispute with major shipping companies.
Negotiations between workers and management are deadl… [+6183 chars]",2024-12-13T22:39:46Z,https://abcnews.go.com/US/trump-backs-dockworkers-fight-automation-move-risks-higher/story?id=116763101
shipping,MacRumors,Tim Hardwick,Report: Google Merging Chrome OS Into Android to Rival iPad,"Google is working on a multi-year project to fully migrate Chrome OS to Android as part of an effort to better compete with Apple's iPad, according to a new report from Android Authority citing an internal source at the company.





The initiative would appa…","Google is working on a multi-year project to fully migrate Chrome OS to Android as part of an effort to better compete with Apple's iPad, according to a new report from Android Authority citing an in… [+1614 chars]",2024-11-19T12:24:09Z,https://www.macrumors.com/2024/11/19/google-merging-chrome-os-android-rival-ipad/
shipping,CNET,Anna Gragert,Over 50% Off: This Full-Length Mirror With Customizable LED Light Temperatures,Upgrade your mirror with this full-length mirror that has customizable LED lights and is now over 50% off for Black Friday.,"Mirrors are a significant part of our lives. After all, who doesn't check themselves in the mirror before running out the door or hopping on a video call? As items we use every day, multiple times a … [+1502 chars]",2024-11-25T19:37:00Z,https://www.cnet.com/deals/over-50-off-full-length-mirror-customizable-led-light-temperatures/
shipping,CNET,Ingrid Cruz,Yamaha's TW-E7B Wireless Noise-Canceling Earbuds Have Fallen in Price by More Than $200,A massive 72% discount has seen these Yamaha buds' price plummet to just $79 across four different colors.,"Picking up a pair of earbuds from a top brand doesn't mean you need to spend over the odds. Sure, Black Friday is over but there are still some great deals out there -- if you know where to look. One… [+1505 chars]",2024-12-05T12:19:00Z,https://www.cnet.com/deals/yamahas-tw-e7b-wireless-noise-cancelling-earbuds-have-fallen-in-price-by-more-than-200/
shipping,ABC News,Luis Martinez,US Navy shoots down Houthi missiles targeting US-flagged ships in Gulf of Aden,Two U.S. Navy destroyers show down incoming Houthi missiles and drones that were targeting three U.S.-flagged commercial ships that the destroyers.,"Two U.S. Navy destroyers shot down incoming Houthi missiles and drones that were targeting three U.S.-flagged commercial ships that the destroyers were escorting in the Gulf of Aden, the U.S. militar… [+1434 chars]",2024-12-02T06:49:24Z,https://abcnews.go.com/International/us-navy-shoots-houthi-missiles-targeting-us-flagged/story?id=116363642
shipping,CNET,Adam Oram,Looking for the Lowest Price? Let These Browser Extensions and Apps Do the Work for You,"Cyber Monday deals are here. Whether we're buying one-off big-ticket items or gifts for loved ones, these shopping tools can help you find the best prices.","If you're doing your holiday shopping now, you're probably looking for ways to save a little cash. The great news is that you don't have to settle for the first price you see: there's always a potent… [+6885 chars]",2024-12-02T18:00:03Z,https://www.cnet.com/tech/services-and-software/looking-for-the-lowest-price-let-these-browser-extensions-and-apps-do-the-work-for-you/
shipping,Buzzfeed,Maitland Quitmeyer,61 Presents That Actually Won't Get Re-Gifted,"We're talking only reactions of genuine delight and not one single forced ""oh thaaaanks.....""View Entire Post ›","Here are the crates you can choose from:
Panda Crate (ages 036 months)
KiwiCo Sprout (ages 36)
KiwiCo World (ages 612+, focus on geography and culture)
KiwiCo Labs (ages 68, focus on science and … [+678 chars]",2024-11-22T11:31:02Z,https://www.buzzfeed.com/maitlandquitmeyer/presents-wont-get-regifted-2023-1
shipping,Buzzfeed,Maitland Quitmeyer,60 Presents That Actually Won't Get Re-Gifted,"We're talking only reactions of genuine delight and not one single forced ""oh thaaaanks.....""View Entire Post ›","Here are the crates you can choose from:
Panda Crate (ages 036 months)
KiwiCo Sprout (ages 36)
KiwiCo World (ages 612+, focus on geography and culture)
KiwiCo Labs (ages 68, focus on science and … [+678 chars]",2024-12-10T07:01:02Z,https://www.buzzfeed.com/maitlandquitmeyer/presents-wont-get-regifted-2024-an
shipping,Buzzfeed,Mallory Mower,46 Gifts You Don't Have To Worry About Them Getting From Someone Else,"Surprising and fun (but not dumb) gifts for everyone from your nephew to your mother-in-law and all the friends, coworkers, and family in between.View Entire Post ›","The basket includes Marin French Cheese Co. Triple Crème Brie (8oz), Marin French Cheese Co. Petite Breakfast (4oz), Laura Chenel Garlic &amp; Chive Goat Cheese Log (4oz), Laura Chenel Thyme &amp; Ro… [+536 chars]",2024-12-11T04:01:02Z,https://www.buzzfeed.com/malloryannp/gifts-no-one-else-will-give-them-2024-an
shipping,Gizmodo.com,Matthew Gault,AI Has Enshittified America’s Advanced Stealth Fighter,A new report on the F-35 revealed how maintenance crews have to constantly fight its terrible AI systems to get anything done.,"Artificial Intelligence has enshittified the F-35, Americas long-embattled 5th generation stealth fighter jet. Produced by Lockheed Martin and coming in three different flavors, the F-35 relies on an… [+4027 chars]",2024-11-21T20:20:57Z,https://gizmodo.com/ai-has-enshittified-americas-advanced-stealth-fighter-2000527934
shipping,Gizmodo.com,Gizmodo Deals,Black Friday: Amazon Just Dropped 10 UNREAL Deals This Sunday (3 Are Already Out of Stock) ,"This Sunday, we've updated our selection of the best deals for this Black Friday on Amazon.","Black Friday is just around the corner (set for this Friday, November 29th) but Amazon has already kicked off its Black Friday Week last Friday. With Amazon’s best price guarantee in place, there’s n… [+4079 chars]",2024-11-24T11:30:11Z,https://gizmodo.com/black-friday-amazon-just-dropped-10-unreal-deals-this-sunday-3-are-already-out-of-stock-2000529128
shipping,Gizmodo.com,AJ Dellinger,Amazon Is a Car Dealership Now,The online retail giant is dipping its toes into selling cars directly to consumers in partnership with Hyundai.,"Somewhere at Carvana headquarters, executives are huddled and watching the water rippling in the glasses of water on their boardroom table like it’s Jurassic Park because the T. rex of the online ret… [+4411 chars]",2024-12-10T20:25:15Z,https://gizmodo.com/amazon-is-a-car-dealership-now-2000536625
shipping,Gizmodo.com,Lucas Ropek,"Billionaire Marc Benioff, Owner of Time, Uses Magazine to Promote His AI Software",Benioff wants you to get excited for the AI revolution.,"When he’s not buying up a weird amount of land in Hawaii or forcing his workers back into the office, billionaire Salesforce CEO Marc Benioff is busy promoting the artificial intelligence technology … [+5026 chars]",2024-12-01T17:10:28Z,https://gizmodo.com/billionaire-marc-benioff-owner-of-time-uses-magazine-to-promote-his-ai-software-2000531146
shipping,BBC News,,"Cop29: US out, China in - the future of climate talks?","What it means for the global climate effort if another superpower comes to the fore, just as Trump steps back","The WhatsApp message was from the chief negotiator of one of the most powerful countries at the COP climate gathering. Could I stop by for a chat, he asked.
As his team hunched over computers eating… [+10148 chars]",2024-11-22T12:07:36Z,https://www.bbc.com/news/articles/c3rx2drd8x8o
shipping,Android Central,patrick.farmer@futurenet.com (Patrick Farmer),"Early Black Friday Garmin deals 2024 — ditch your old smartwatch and save big on Forerunner, Venu, and more","Garmin's holiday sale is LIVE, and retailers all over the web are dropping major discounts on some of our favorite smartwatches.","If you're planning to buy a new smartwatch this holiday season, you'll be pleased to learn that many of the best Black Friday Garmin deals have already gone live. Retailers like Best Buy and Amazon a… [+1938 chars]",2024-11-20T20:58:44Z,https://www.androidcentral.com/wearables/early-black-friday-garmin-deals-2024-ditch-your-old-smartwatch-and-save-big-on-forerunner-venu-and-more
shipping,Android Central,michael.hicks@futurenet.com (Michael L Hicks),Gollum would murder hobbitses to get this 43% OFF smart ring lightning deal before Cyber Monday ends,"The RingConn Gen 1 smart ring is on our ""Best smart rings"" list, and it's currently 43% ($120) off thanks to a Cyber Monday lightning deal.","Have you (or your alternate personality) been coveting a smart ring, but find most smart rings are too expensive or owned by thieving Bagginses? Rather than pay a dragon's hoard worth of money on an … [+2293 chars]",2024-12-02T20:19:12Z,https://www.androidcentral.com/wearables/gollum-would-murder-hobbitses-to-get-this-43-percent-off-smart-ring-lightning-deal-before-cyber-monday-ends
