topic,source,author,title,description,content,published_at,url
freight rates,Yahoo Entertainment,Noi Mahoney,Borderlands Mexico: Cyberattacks rise in Mexico as cross-border trade grows,This week in Borderlands: Cyberattacks rise in Mexico as cross-border trade grows; California begins construction of second Otay Mesa border port of entry...,"Yahoo is using AI to generate takeaways from this article. This means the info may not always match what's in the article. Reporting mistakes helps us improve the experience.Generate Key Takeaways
B… [+6481 chars]",2024-12-15T12:00:00Z,https://www.yahoo.com/news/borderlands-mexico-cyberattacks-rise-mexico-120000395.html
freight rates,Livemint,Subhash Narayan,Railways developing Vande Bharat parcel trains for e-commerce shipping,The national transporter hopes that the new service using the semi-fast trains will help it regain some of the non-bulk freight business that has moved to roadways and air cargo.,The Indian Railways plans to run dedicated Vande Bharat parcel trains on specific routes to capture a chunk of goods shipped by online marketplaces like Amazon and Flipkart that use road and air carg… [+4205 chars],2024-12-07T00:00:01Z,https://www.livemint.com/industry/railways-vande-bharat-parcel-trains-e-commerce-shipping-amazon-flipkart-air-cargo-freight-online-retail-logistics-11733485864529.html
freight rates,BusinessLine,Surendra  Ahirwar,Shipping reforms can build supply chain resilience,"By modernising ports and supporting sustainable logistics, India help deal with supply chain vulnerabilities","The Covid- pandemic exposed the vulnerability of global supply chains (GSCs). The subsequent geopolitical crises, including the Suez Canal blockage in 2021, the ongoing Israel-Gaza conflict, and the … [+4182 chars]",2024-12-01T15:06:01Z,https://www.thehindubusinessline.com/opinion/shipping-reforms-can-build-supply-chain-resilience/article68935477.ece
freight rates,gcaptain.com,Mike Schuler,Wallenius Wilhelmsen Secures Contracts Worth $375M as Market Shows Signs of Cooling,"Wallenius Wilhelmsen has secured two major multi-year contracts with leading automotive manufacturers, both featuring biofuel components. The deals, valued at approximately $375 million combined, demonstrate a growing commitment to environmental...","Wallenius Wilhelmsen has secured two major multi-year contracts with leading automotive manufacturers, both featuring biofuel components. The deals, valued at approximately $375 million combined, dem… [+2067 chars]",2024-12-13T15:40:24Z,https://gcaptain.com/wallenius-wilhelmsen-secures-contracts-worth-375m-as-market-shows-signs-of-cooling/
freight rates,Overdriveonline.com,Overdrive Staff,POLL: Your view of FMCSA's broker transparency proposal?,"If you've had time to digest the details, do you think the changes, if implemented, stand to materially impact rates and/or brokered-freight market dynamics? Weigh in here.","The Federal Motor Carrier Safety Administration's notice on November 20, 2024, proposed several changes to federal regulations governing brokered-freight transaction records. Perhaps the most impactf… [+1052 chars]",2024-11-22T15:53:26Z,https://www.overdriveonline.com/voices/article/15708902/poll-weigh-in-on-fmcsas-broker-transparency-proposal-impact
freight rates,Overdriveonline.com,Overdrive Staff,Heniff purchases 30-truck Hagen Johnson | The Thanksgiving spot market freight lull,Terms of the Heniff Transportation Systems-30-truck Hagen Johnson Trucking deal were not disclosed. Also: Be on the lookout for opportunity in brokered-freight markets this week. Post-Thanksgiving rates typically rise for dry vans/reefers.,"Trucking news and briefs for Dec. 3, 2024: 
30-truck tanker fleet Hagen Johnson acquired by Heniff
Heniff Transportation Systems (CCJ Top 250, No. 64) has acquired 30-truck food grade tanker hauler… [+2480 chars]",2024-12-03T08:21:05Z,https://www.overdriveonline.com/business/article/15709565/heniff-purchases-30truck-hagen-johnson-the-thanksgiving-spot-market-freight-lull
freight rates,BusinessLine,Subramani Ra Mancombu,Pakistan offers India stiff competition as global rice prices rise after sharp fall,"Global rice prices firm up after 10% drop, with Pakistan offering tough competition to India. Ramadan demand drives prices.","Rice prices in the global market have begun to firm up after dropping over 10 per cent. Still, Pakistan is offering tough competition to India with its competitive pricing.
Rice prices have begun to… [+3341 chars]",2024-11-29T11:38:22Z,https://www.thehindubusinessline.com/economy/agri-business/pakistan-offers-india-stiff-competition-as-global-rice-prices-rise-after-sharp-fall/article68926975.ece
freight rates,GlobeNewswire,"XPO, Inc.",XPO Provides North American LTL Operating Data for November 2024,"GREENWICH, Conn., Dec. 03, 2024 (GLOBE NEWSWIRE) -- XPO
 (NYSE: XPO), a leading provider of freight transportation in North America, today reported certain preliminary LTL segment operating metrics for November 2024. LTL tonnage per day decreased 4.0%, as co…","GREENWICH, Conn., Dec. 03, 2024 (GLOBE NEWSWIRE) -- XPO
 (NYSE: XPO), a leading provider of freight transportation in North America, today reported certain preliminary LTL segment operating metrics … [+4703 chars]",2024-12-03T21:05:00Z,https://www.globenewswire.com/news-release/2024/12/03/2991058/0/en/XPO-Provides-North-American-LTL-Operating-Data-for-November-2024.html
freight rates,Overdriveonline.com,Alex Lockie,Uber Freight launched what sounds like a load board -- or is it 'double brokering'?,"When the digital freight broker opened up a new ""Broker Access"" avenue to their carriers for other brokers, some freight middlemen had a meltdown over ""double brokering"" concerns.","Digital freight broker Uber Freight recently announced it would open up a new platform it calls Broker Access, allowing fellow brokers to post loads and have its freight-matching technology work its … [+10616 chars]",2024-11-22T18:47:05Z,https://www.overdriveonline.com/business/article/15708889/is-uber-freights-new-broker-access-tool-double-brokering
freight rates,GlobeNewswire,ITS Logistics,ITS Logistics December Port Rail Ramp Index: US West Coast Ports Experience Significant Import Volumes Amid Fears of January ILA Strike,-- ITS Logistics confirms East and Gulf Coast ports are experiencing normal calm post retail peak and prior to Lunar New Year -- -- ITS Logistics confirms East and Gulf Coast ports are experiencing normal calm post retail peak and prior to Lunar New Year --,"RENO, Nev., Dec. 11, 2024 (GLOBE NEWSWIRE) -- ITS Logistics today released the December forecast for the ITS Logistics US Port/Rail Ramp Freight Index. This month, the index confirms that at a macro … [+4778 chars]",2024-12-11T16:34:00Z,https://www.globenewswire.com/news-release/2024/12/11/2995587/0/en/ITS-Logistics-December-Port-Rail-Ramp-Index-US-West-Coast-Ports-Experience-Significant-Import-Volumes-Amid-Fears-of-January-ILA-Strike.html
freight rates,Yahoo Entertainment,"Kate Linthicum, Patrick J. McDonnell","Bluff or existential threat? As Trump vows tariffs on all imports from Canada, Mexico and China, leaders wonder if he's serious","President-elect Donald Trump vowed to enact hefty new tariffs on Mexico, Canada and China as soon as he takes office as part of a crackdown on illegal...","Yahoo is using AI to generate takeaways from this article. This means the info may not always match what's in the article. Reporting mistakes helps us improve the experience.Generate Key Takeaways
B… [+10346 chars]",2024-11-26T23:51:40Z,https://www.yahoo.com/news/bluff-existential-threat-trump-vows-235140763.html
freight rates,gcaptain.com,Mike Schuler,Shipping Magnate Pivots Her $6 Billion Fortune Towards Equities,"The family office for Maria Angelicoussis, Greece’s richest shipping magnate, is boosting publicly traded investments after notching up huge gains in private market bets, according to people with knowledge of the matter.","By Ben Stupples (Bloomberg) —
The family office for Maria Angelicoussis, Greeces richest shipping magnate, is boosting publicly traded investments after notching up huge gains in private market bets… [+2775 chars]",2024-11-29T15:54:17Z,https://gcaptain.com/shipping-magnate-pivots-her-6-billion-fortune-towards-equities/
freight rates,Livemint,Subhash Narayan,"Highway toll revenue growth slows, may fall short of FY25 target","India's highway toll collection may miss  ₹70,000 crore target for FY25. But it's expected to pick up from next year onwards as more toll roads get commissioned.","India's highway toll collection growth is slowing and may fall short of the projected 70,000 crore in the current financial year, according to two persons aware of the development, mirroring the slow… [+5060 chars]",2024-12-07T00:00:00Z,https://www.livemint.com/industry/national-highway-toll-collection-wholesale-price-construction-mining-manufacture-bharatmala-fastag-11733479426654.html
freight rates,CNBC,,The shipping industry is wrestling with one of its largest challenges,"The shipping industry is contending with a shortage of seafarers, and it's fueling a troubling mix of fake resumes, accidents at sea, and higher freight rates.","Containers near a berthed cargo vessel at a terminal in the southeastern port city of Busan on Nov. 24, 2024.
The shipping industry is contending with a worldwide shortage of seafarers, and it's fue… [+6122 chars]",2024-11-26T23:30:07Z,https://www.cnbc.com/2024/11/27/the-shipping-industry-is-wrestling-with-one-of-its-largest-challenges.html
freight rates,Investing.com,Reuters,"Most Japan firms expect Trump presidency to harm business environment, Reuters survey shows","Most Japan firms expect Trump presidency to harm business environment, Reuters survey shows","By Kiyoshi Takenaka
TOKYO (Reuters) - Nearly three-quarters of Japanese companies expect Donald Trump's next term as U.S. president to have a negative impact on their business environment, citing pl… [+3093 chars]",2024-12-11T23:05:42Z,https://www.investing.com/news/economy-news/most-japan-firms-expect-trump-presidency-to-harm-business-environment-reuters-survey-shows-3767709
freight rates,Overdriveonline.com,Long Haul Paul,Broker 'confessions' novel aims at seedy underbelly of digital freight culture,"The new work of fiction is authored by a former broker, and here reviewed by Long Haul Paul. The novel aims to chronicle the underbelly of digital freight culture..","Author Cameron B. Ritter's new novel is out as of early November.
Talk about your broker transparency! If half of Cameron B. Ritters new novel, Confessions of a Freight Broker, has its basis in fact… [+9475 chars]",2024-11-27T07:31:46Z,https://www.overdriveonline.com/overdrive-extra/article/15709245/confessions-of-a-freight-broker-sends-up-seedy-middlemen
freight rates,BusinessLine,BL Mangaluru Bureau,SEA seeks govt support for mustard farmers to boost rapeseed meal exports,"SEA seeks government support to boost rapeseed meal exports, maintain MSP, and address challenges in the oilmeal industry.",The Solvent Extractors Association of India (SEA) has sought the Governments help to boost the export of rapeseed meal and maintain MSP (minimum support price) for rapeseed-mustard to support farmers… [+3204 chars],2024-11-18T11:26:26Z,https://www.thehindubusinessline.com/economy/agri-business/sea-seeks-govt-support-for-mustard-farmers-to-boost-rapeseed-meal-exports/article68881674.ece
freight rates,BusinessLine,BL Mangaluru Bureau,SEA President favours adoption of genetically modified crops to improve oilseeds’ productivity,Solvent Extractors’ Association of India advocates for GMO crops to boost oilseed productivity and address edible oil demand gap.,"The Solvent Extractors Association of India (SEA) has said the adoption of genetically modified (GMO) crops could revolutionise oilseed productivity in the country. 
In his letter to the members of … [+2884 chars]",2024-11-21T10:34:47Z,https://www.thehindubusinessline.com/economy/agri-business/sea-president-favours-adoption-of-genetically-modified-crops-to-improve-oilseeds-productivity/article68893185.ece
freight rates,GlobeNewswire,"TA Services, Inc.",TA Recognized with 2024 Food Logistics and Supply & Demand Chain Executive Top Software and Technology Solutions Award,Honoring TA’s ongoing commitment to innovation and customer-focused supply chain solutions Honoring TA’s ongoing commitment to innovation and customer-focused supply chain solutions,"MANSFIELD, Texas, Dec. 09, 2024 (GLOBE NEWSWIRE) -- TA, a leading North American third-party logistics provider (3PL), announces its recognition as a winner of the 2024 Food Logistics and Supply &amp… [+4559 chars]",2024-12-09T16:30:00Z,https://www.globenewswire.com/news-release/2024/12/09/2993941/0/en/TA-Recognized-with-2024-Food-Logistics-and-Supply-Demand-Chain-Executive-Top-Software-and-Technology-Solutions-Award.html
freight rates,Economictimes.com,,India's economic slowdown: How to keep it at 7-8%,"India's recent economic slowdown has prompted a reassessment of growth strategies. Sluggish private consumption and investment, alongside global challenges, necessitate a shift.  While public investment spurred initial recovery, the focus must now turn to pri…",Slowdown in growth in Q2 FY25 wasn't quite predicted by GoI or economists. It has forced everyone to look closely at the growth scenario at a time when 6-7% seemed a given. Even in challenging global… [+4035 chars],2024-12-09T17:34:34Z,https://m.economictimes.com/opinion/et-commentary/indias-economic-slowdown-how-to-keep-it-at-7-8/articleshow/116147818.cms
freight rates,Overdriveonline.com,Gary Buchs,Post-election optimism yields opportunity: A new start for your trucking business,A big shfit in mood post-election delivers opportunity for a reset. Yet don't let knee-jerk reaction overtake the necessity of careful planning.,"Like a shock from a defibrillator applied to the chest of an accident victim on the morning of November 6, the stock market and investor optimism jerked and seemed to wake up, with the S&amp;P hittin… [+7094 chars]",2024-12-03T18:17:12Z,https://www.overdriveonline.com/overdrive-extra/article/15709543/notes-on-a-new-start-for-your-trucking-business
freight rates,Overdriveonline.com,Overdrive Staff,Fleet owner guilty of orchestrating Ponzi scheme,"Sanjay Singh, owner of Royal Bengal Logistics Inc., was found guilty by a Florida court this month and will be sentenced in February. Also: Trucking conditions were on definite decline through late Summer; Groendyke gets brake-light exemption renewal.","Trucking news and briefs for Wednesday, Nov. 20, 2024: 
Ponzi scheme charges: Sanjay Singh of Royal Bengal Logistics found guilty
A jury in the U.S. District Court for the Southern District of Flor… [+3563 chars]",2024-11-20T08:53:56Z,https://www.overdriveonline.com/life/article/15708766/fleet-owner-guilty-of-orchestrating-ponzi-scheme
freight rates,Investing.com,Investing.com,"Heartland Express, Inc. Announces Participation in Upcoming Conference","Heartland Express, Inc. Announces Participation in Upcoming Conference","NORTH LIBERTY, Iowa, Nov. 25, 2024 (GLOBE NEWSWIRE) -- Heartland Express , Inc. (Nasdaq: NASDAQ:HTLD) announced that Chris Strain, Chief Financial Officer, will participate at the 2024 UBS Global Ind… [+2368 chars]",2024-11-25T22:48:41Z,https://www.investing.com/news/press-releases/heartland-express-inc-announces-participation-in-upcoming-conference-93CH-3740986
freight rates,Overdriveonline.com,Alex Lockie,Brokers plan to fight FMCSA's transparency push,"FMCSA's new notice of proposed rulemaking has brokers up in arms, but one small fleet owner said it's ""about damn time"" that 49 CFR 371.3 was enforced.",The FMCSA on Tuesday sent shockwaves through the freight world by announcing it intended to make a rule obliging brokers to provide carriers detailed transaction records -- including the rate the shi… [+10445 chars],2024-11-20T10:20:08Z,https://www.overdriveonline.com/regulations/article/15708760/fmcsas-transparency-push-brokers-are-gearing-up-to-fight
freight rates,GlobeNewswire,"Heartland Express, Inc.","Heartland Express, Inc. Announces Participation in Upcoming Conference","NORTH LIBERTY, Iowa, Nov. 25, 2024 (GLOBE NEWSWIRE) -- Heartland Express, Inc. (Nasdaq: HTLD) announced that Chris Strain, Chief Financial Officer, will participate at the 2024 UBS Global Industrials and Transportation Conference on Wednesday, December 4, 202…","NORTH LIBERTY, Iowa, Nov. 25, 2024 (GLOBE NEWSWIRE) -- Heartland Express, Inc. (Nasdaq: HTLD) announced that Chris Strain, Chief Financial Officer, will participate at the 2024 UBS Global Industrials… [+2323 chars]",2024-11-25T22:45:00Z,https://www.globenewswire.com/news-release/2024/11/25/2987128/15800/en/Heartland-Express-Inc-Announces-Participation-in-Upcoming-Conference.html
freight rates,OilPrice.com,Michael Kern,Bullish Catalysts Build in Oil Markets But Prices Remain Rangebound,"It's been a relatively calm week for oil prices despite plenty of developments on both the geopolitical and fundamental front, but prices might just begin to climb next week. Thanksgiving has disrupted a highly eventful week that saw OPEC+ ramp up its shuttle…","China is doing the unthinkable…
The total number of active…
Russia's shadow fleet has shifted…
By Michael Kern - Nov 29, 2024, 7:30 AM CSTIt's been a relatively calm week for oil prices despite pl… [+4731 chars]",2024-11-29T13:30:00Z,https://oilprice.com/Energy/Energy-General/Bullish-Catalysts-Build-in-Oil-Markets-But-Prices-Remain-Rangebound.html
freight rates,Overdriveonline.com,Matt Cole,Transparency: FMCSA proposes 'regulatory obligation' for brokers,"Among the four proposed amendments to the transparency regs is one that would move motor carriers' ""right"" to review records to a ""regulatory obligation"" for brokers to provide the record when requested.","After more than four and a half years since petitions were filed from trucking groups seeking increased brokered freight transparency, the Federal Motor Carrier Safety Administration on Wednesday wil… [+10338 chars]",2024-11-19T16:04:54Z,https://www.overdriveonline.com/regulations/article/15708608/proposed-broker-transparency-rule-puts-regulatory-obligation-on-brokers
freight rates,Ritholtz.com,Barry Ritholtz,Transcript: Colin Camerer on Neuroeconomics,"The transcript from this week’s, MiB: Colin Camerer on Neuroeconomics, is below. You can stream and download our full conversation, including any podcast extras, on Apple Podcasts, Spotify, YouTube, and Bloomberg. All of our earlier podcasts on your favorite …","The transcript from this weeks, MiB: Colin Camerer on Neuroeconomics, is below.
You can stream and download our full conversation, including any podcast extras, on Apple Podcasts, Spotify, YouTube, … [+99585 chars]",2024-11-19T13:30:42Z,https://ritholtz.com/2024/11/transcript-colin-camerer/
freight rates,Bitrebels.com,Daniel Sky,Transforming Delivery Processes: The Advantages Of Route Optimization Software For Enterprises,"Efficient delivery operations are crucial as customer expectations for speed and flexibility continue to rise. Route optimization software is revolutionizing logistics, enabling enterprises to cut delivery costs while enhancing customer satisfaction through p…","Efficient delivery operations are crucial as customer expectations for speed and flexibility continue to rise. Route optimization software is revolutionizing logistics, enabling enterprises to cut de… [+8192 chars]",2024-12-12T09:30:00Z,https://bitrebels.com/business/transforming-delivery-processes-advantages-route-optimization-software-enterprises/
freight rates,The Irish Times,Justine McCarthy,Forget politicians’ pre-election promises - here’s my 10-point manifesto,My general election wish list: No more free Dáil parking; penalty points for drivers who keep the engine running while stationary; immunity for employees who refuse to handle Israeli goods ...,"The word manifesto derives from Latin via the Italian manifestus, meaning obvious, a fact providing ample grounds for any voter to file an immediate complaint of false advertising against a host of p… [+6610 chars]",2024-11-22T06:06:00Z,https://www.irishtimes.com/opinion/2024/11/22/justine-mccarthy-dear-politicians-heres-my-ten-point-election-manifesto/
freight rates,BusinessLine,Aneesh Phadnis,"Airlines brace for increased costs, market share losses amid ongoing supply chain woes","Airlines struggle with supply chain issues, impacting sustainability goals and customer service, leading to delays and increased costs.","Airlines are investing in new planes and products but lingering supply chain issues are hampering their plans to meet their sustainability goals and provide better service to customers.
While passen… [+4158 chars]",2024-12-04T08:29:35Z,https://www.thehindubusinessline.com/companies/airlines-brace-for-increased-costs-market-share-losses-amid-ongoing-supply-chain-woes/article68945800.ece
freight rates,pymnts.com,PYMNTS,"This Week in B2B: Simplicity, Automation and Blockchain (Yes, Blockchain)","The contemporary B2B landscape is being reshaped by a seismic shift toward automation and simplification. Companies are ditching clunky, manual processes in favor of sleek, digital-first solutions that prioritize speed, simplicity and scalability. The winners…","The contemporary B2B landscape is being reshaped by a seismic shift toward automation and simplification.
Companies are ditching clunky, manual processes in favor of sleek, digital-first solutions t… [+6999 chars]",2024-11-21T19:50:36Z,https://www.pymnts.com/news/2024/this-week-in-b2b-simplicity-automation-and-blockchain-yes-blockchain/
freight rates,GlobeNewswire,Golden Ocean Group Limited,GOGL – Third Quarter 2024 Results,"Hamilton, Bermuda, November 27, 2024 - Golden Ocean Group Limited (NASDAQ/OSE: GOGL) (the “Company” or “Golden Ocean”), the world's largest listed owner of large size dry bulk vessels, today announced its unaudited results for the quarter ended September 30, …","Hamilton, Bermuda, November 27, 2024 - Golden Ocean Group Limited (NASDAQ/OSE: GOGL) (the Company or Golden Ocean), the world's largest listed owner of large size dry bulk vessels, today announced it… [+13019 chars]",2024-11-27T07:00:00Z,https://www.globenewswire.com/news-release/2024/11/27/2987967/0/en/GOGL-Third-Quarter-2024-Results.html
freight rates,BusinessLine,Aneesh Phadnis,"Airlines brace for increased costs, market share losses amid ongoing supply chain woes","Airlines struggle with supply chain issues, impacting sustainability goals and customer service, leading to delays and increased costs.","Airlines are investing in new planes and products but lingering supply chain issues are hampering their plans to meet their sustainability goals and provide better service to customers.
While passen… [+4135 chars]",2024-12-04T08:29:35Z,https://www.thehindubusinessline.com/economy/logistics/airlines-brace-for-increased-costs-market-share-losses-amid-ongoing-supply-chain-woes/article68945800.ece
freight rates,Investing.com,Reuters,Flour millers face supply crunch as wheat farmers tighten grip on stocks,Flour millers face supply crunch as wheat farmers tighten grip on stocks,"By Naveen Thukral and Renee Hickman
SINGAPORE/CHICAGO (Reuters) - Wheat growers in several exporting countries are reluctant to sell their crops with prices near four-year lows, traders, farmers and… [+3771 chars]",2024-11-21T05:46:35Z,https://www.investing.com/news/economy-news/flour-millers-face-supply-crunch-as-wheat-farmers-tighten-grip-on-stocks-3733877
freight rates,Investing.com,Investing.com,BW LPG Limited - Financial Results for Q3 2024,BW LPG Limited - Financial Results for Q3 2024,"SINGAPORE--(BUSINESS WIRE)--Highlights and Subsequent Events
<ul><li>Another good quarter for shipping with TCE income - Shipping Q3 2024 concluded at US$46,800 per available day and US$46,500 per c… [+9178 chars]",2024-12-02T07:44:03Z,https://www.investing.com/news/press-releases/bw-lpg-limited--financial-results-for-q3-2024-93CH-3748141
freight rates,gcaptain.com,Mike Schuler,Trade War 2.0? Trump Announces Tariffs on Top Trading Partners,"President-elect Donald Trump vowed additional tariffs on Mexico, Canada and China, shaking markets with his first specific threats to the US’s top trading partners since his election win three weeks ago.","By Nancy Cook and Brian Platt (Bloomberg) —
President-elect Donald Trump vowed additional tariffs on Mexico, Canada and China, shaking markets with his first specific threats to the USs top trading … [+7867 chars]",2024-11-26T15:48:56Z,https://gcaptain.com/trade-war-2-0-trump-announces-tariffs-on-top-trading-partners/
freight rates,Overdriveonline.com,Overdrive Staff,Fossil fuel company exec picked to lead Energy Department,"Chris Wright, founder of Liberty Energy, is viewed as a fossil fuel ""pragmatist."" Also: Pre-Thanksgiving rates bump; Mack, Volvo dealer expands with acquisition in the Midwest; driver named Highway Angel for helping pedestrians involved in hit-and-run.","Trucking news and briefs for Tuesday, Nov. 26, 2024: 
Trumps Energy Secretary pick led fossil-fuel-focused Liberty Energy
Chris Wright, CEO of Denver-based Liberty Energy, is Trump's nominee to lea… [+6912 chars]",2024-11-26T18:37:11Z,https://www.overdriveonline.com/regulations/article/15709157/trumps-energy-department-nominee-a-fossil-fuel-company-exec
