topic,source,author,title,description,content,published_at,url
crypto,Yahoo Entertainment,,Crypto Crumbles in Broad Selloff Led 20% Declines Across Numerous Altcoins,,"If you click 'Accept all', we and our partners, including 237 who are part of the IAB Transparency &amp; Consent Framework, will also store and/or access information on a device (in other words, use … [+678 chars]",2024-12-09T21:15:58Z,https://consent.yahoo.com/v2/collectConsent?sessionId=1_cc-session_563edb54-5c42-43fa-8c77-4a0a246f60f9
crypto,ABC News,Peter Charalambous,Chinese entrepreneur sued for fraud invests $30 million in Trump crypto venture,A $30 million investment in Donald Trump's new crypto venture made by a Chinese billionaire accused of fraud by the SEC is sparking concerns from government watchdogs.,A sudden infusion of $30 million into Donald Trump's nascent cryptocurrency venture from a Chinese billionaire sued by the Securities and Exchange Commission for allegedly defrauding investors could … [+9110 chars],2024-12-06T21:17:14Z,https://abcnews.go.com/US/chinese-entrepreneur-sued-fraud-invests-30-million-trump/story?id=116499146
crypto,Business Insider,fdemott@insider.com (Filip De Mott),Stock market today: Indexes slip after hitting records as investors await fresh economic data,"Investors are waiting for new economic data this week, with October's JOLTS report scheduled for Tuesday and the November payroll report due on Friday.","US indexes were lower Tuesday as momentum waned on the back of a new closing high for the S&amp;P 500 and the Nasdaq. 
Investors are now bracing for several economic updates scheduled for this week.… [+1210 chars]",2024-12-03T14:54:50Z,https://markets.businessinsider.com/news/stocks/stock-market-today-sp500-record-high-holts-labor-fed-cuts-2024-12
crypto,Business Insider,knotopoulos@businessinsider.com (Katie Notopoulos),The Grinch loves knee surgery. That's it. That's the meme.,An absurd meme about the Grinch is burning up middle schools. It's also inevitably spawned a meme coin. Doesn't make sense? I'll try to explain.,"Over Thanksgiving, a family friend who happens to be in middle school showed me some memes from her debate club group chat, including something she found particularly funny: an image of the Grinch, b… [+3696 chars]",2024-12-02T20:08:31Z,https://www.businessinsider.com/grinch-knee-surgery-is-tomrorow-meme-explained-2024-12
crypto,ABC News,Max Zahn,"Bitcoin races past $100,000, fueled by post-election rally",The price of bitcoin has surged more than 40% since Election Day.,"The price of bitcoin surpassed $100,000 for the first time on Wednesday, soaring to a fresh high as the worlds largest cryptocurrency extended a rally set off by the election of former President Dona… [+3395 chars]",2024-12-05T03:15:38Z,https://abcnews.go.com/Business/bitcoin-races-past-100000-dollars-fueled-post-election-rally/story?id=116127616
crypto,Uncrate.com,Uncrate,Ledger Flex Crypto Wallet,"The Ledger Flex is the latest addition to Ledger's line of hardware crypto wallets for a secure way to manage over 5,500 supported coins and tokens. The Flex uses a clear, crisp E Ink display to review and Clear Sign...","Whether your Ford has a few miles on it and needs a few upgrades or if it's new and just needs some personalization, Ford Accessories has you covered. For the performance-minded, there are upgraded s… [+461 chars]",2024-11-22T19:00:00Z,https://uncrate.com/ledger-flex-crypto-wallet/
crypto,Gizmodo.com,Rhett Jones,Trump Names Elon Musk’s Pal as ‘AI and Crypto Czar’,David Sacks is a former member of the PayPal mafia and currently a podcaster.,"President-elect Trump has announced that David Sacks will serve as his White House A.I. &amp; Crypto Czar, according to a post from his account on Truth Social. Sacks is a venture capitalist and host… [+4188 chars]",2024-12-06T17:20:12Z,https://gizmodo.com/trump-names-elon-musks-pal-as-ai-and-crypto-czar-2000535364
crypto,Business Insider,Tess Martinelli,"My husband and I quit our jobs and moved to Finland. This is the perfect place to recover, but my burnout is still raging.",Marija Riba and her husband quit their jobs and moved from London to Finland. She loves her new slower life but is still suffering from burnout.,"Marija Riba says she and her husband are coping with their career gap differently.Marija Riba
<ul><li>Marija Riba and her husband quit their jobs and moved from London to Finland.</li><li>Riba exper… [+5672 chars]",2024-11-18T10:03:01Z,https://www.businessinsider.com/quit-jobs-moved-finland-from-london-burnout-recovery-2024-11
crypto,BBC News,,"A $6.2m banana, a crypto empire and Trump's potential conflicts",Trump's expanding business ventures have made it easier than ever for those hoping to influence US policy to steer money his way.,"Not long after buying and publicly consuming a $6.2m banana as part of an artworld stunt, Chinese crypto entrepreneur Justin Sun made another eye-catching purchase, investing $30m ($23.5m) into a cry… [+7554 chars]",2024-12-08T01:54:44Z,https://www.bbc.com/news/articles/c4gzz5wdg41o
crypto,Yahoo Entertainment,Yahoo Finance,How blockchain technology sets crypto apart,"Listen and subscribe to Financial Freestyle on Apple Podcasts, Spotify, or wherever you find your favorite podcasts. On the latest episode of Financial...","Listen and subscribe to Financial Freestyle on Apple Podcasts, Spotify, or wherever you find your favorite podcasts.
On the latest episode of Financial Freestyle with Ross Mac, Tall Guy Tycoon Arman… [+1137 chars]",2024-12-07T15:00:25Z,https://finance.yahoo.com/video/blockchain-technology-sets-crypto-apart-150025032.html
crypto,Yahoo Entertainment,,Microsoft Just Made a Momentous Decision About Bitcoin That Could Dramatically Affect Your Ability to Become a Crypto Millionaire,,"If you click 'Accept all', we and our partners, including 237 who are part of the IAB Transparency &amp; Consent Framework, will also store and/or access information on a device (in other words, use … [+678 chars]",2024-12-15T10:00:00Z,https://consent.yahoo.com/v2/collectConsent?sessionId=1_cc-session_b06ab0b2-f30d-4c04-b139-2e935f6c67c7
crypto,Wired,"Andy Greenberg, Lily Hay Newman",US Officials Recommend Encryption Apps Amid Chinese Telecom Hacking,"Plus: Russian spies keep hijacking other hackers’ infrastructure, Hydra dark web market admin gets life sentence in Russia, and more of the week’s top security news.",A consortium of global law enforcement agencies led by Britains National Crime Agency announced a takedown operation this week against two major Russian money-laundering networks that process billion… [+8213 chars],2024-12-07T11:30:00Z,https://www.wired.com/story/encryption-apps-chinese-telecom-hacking-hydra-russia-exxon/
crypto,ABC News,"Lalee Ibssa, Kelsey Walsh, Soo Rin Kim",Trump announces new role for his administration: 'White House AI and crypto czar',David Sacks is a longtime ally of Elon Musk and the former COO of PayPal.,"President-elect Donald Trump announced he created a new role for his administration, White House Artificial Intelligence and Crypto Czar.
Filling the role will be tech entrepreneur and podcast host … [+1731 chars]",2024-12-06T05:37:39Z,https://abcnews.go.com/Politics/trump-announces-new-role-administration-names-paypal-founder/story?id=116509911
crypto,Yahoo Entertainment,Yousra Anwar Ahmed,What Happened in Crypto Today: Why Traders Are Obsessed With Next Week,Here is a 2-minute breakdown of everything important that happened in crypto today.,"What Happened in Crypto Today: Why Traders Are Obsessed With Next Week
Bitcoin just dropped below $100K for the fifth time this week.
Those sell orders aren't slowing down.
While Bitcoin is stumbl… [+4137 chars]",2024-12-09T09:01:10Z,https://finance.yahoo.com/news/happened-crypto-today-why-traders-090110626.html
crypto,Gizmodo.com,Lucas Ropek,Judge Rules Decentralized Autonomous Organizations Aren’t So Decentralized in the Eyes of the Law,Crypto's libertarian dreams continue to be thwarted by legal realities.,"The cryptocurrency industry has long been fueled by a libertarian ethos that sees government oversight and regulatory scrutiny as the enemy of economic freedom. At the same time, it is also an indust… [+5485 chars]",2024-11-19T23:10:33Z,https://gizmodo.com/judge-rules-decentralized-autonomous-organizations-arent-so-decentralized-in-the-eyes-of-the-law-2000526564
crypto,9to5Mac,Ryan Christoffel,You can buy Bitcoin with Apple Pay via new Coinbase rollout,"Bitcoin and other cryptocurrencies are getting easier to buy into, as Coinbase is rolling out a new integration today for purchasing crypto via Apple Pay across third-party apps. Here are the details.



 more…","Bitcoin and other cryptocurrencies are getting easier to buy into, as Coinbase is rolling out a new integration today for purchasing crypto via Apple Pay across third-party apps. Here are the details… [+868 chars]",2024-12-02T20:10:06Z,https://9to5mac.com/2024/12/02/you-can-buy-bitcoin-with-apple-pay-via-new-coinbase-rollout/
crypto,Yahoo Entertainment,Shaun Pruitt,Buy the Dip in Coinbase (COIN) Stock as Bitcoin Slides Below $100K?,Coinbase Global (COIN) appears to be taking advantage of the growing optimism and support for Bitcoin among other cryptocurrencies.,"Despite Bitcoin's recent dip below $100,000, Coinbase's stock has risen 80% year-to-date, driven by improved financial performance, including a 100% increase in quarterly sales and a 341.36% average … [+4648 chars]",2024-12-09T22:58:00Z,https://finance.yahoo.com/news/buy-dip-coinbase-coin-stock-225800931.html
crypto,Slashdot.org,EditorDavid,Thousands of Palo Alto Networks Firewalls Compromised This Week After Critical Security Hole,"Palo Alto Networks boasts 70,000 customers in 150 countries, including 85% of the Fortune 500. 

But this week ""thousands of Palo Alto Networks firewalls were compromised by attackers exploiting two recently patched security bug,"" reports the Register:


The …","Palo Alto Networks boasts 70,000 customers in 150 countries, including 85% of the Fortune 500.But this week ""thousands of Palo Alto Networks firewalls were compromised by attackers exploiting two rec… [+1723 chars]",2024-11-25T12:34:00Z,https://it.slashdot.org/story/24/11/25/063246/thousands-of-palo-alto-networks-firewalls-compromised-this-week-after-critical-security-hole
crypto,MarketWatch,Chris Matthews,David Sacks and the coming crypto war over national security,The crypto industry and GOP will have to navigate thorny issues related to terrorism and international crime.,"The crypto industry has been in a state of near euphoria since the election of incoming President Donald Trump, as digital-asset holders expect a wave of crypto-friendly policies that could help powe… [+249 chars]",2024-12-06T20:54:00Z,https://www.marketwatch.com/story/david-sacks-and-the-coming-crypto-war-over-national-security-cc22c486
crypto,CNET,Julian Dossett,Kraken Axes NFT Marketplace. Here's What to Do if You Have NFTs on This Crypto Exchange,"The crypto exchange's NFT marketplace is now in ""withdrawal-only mode.""","Kraken, a large US-based cryptocurrency exchange, is shuttering its NFT marketplace after launching the service about two years ago. Kraken announced the closure in late November. Kraken users have u… [+3038 chars]",2024-12-12T11:30:55Z,https://www.cnet.com/personal-finance/crypto/kraken-axes-nft-marketplace-heres-what-to-do-if-you-have-nfts-on-this-crypto-exchange/
crypto,Gizmodo.com,Lucas Ropek,"Billionaire Marc Benioff, Owner of Time, Uses Magazine to Promote His AI Software",Benioff wants you to get excited for the AI revolution.,"When he’s not buying up a weird amount of land in Hawaii or forcing his workers back into the office, billionaire Salesforce CEO Marc Benioff is busy promoting the artificial intelligence technology … [+5026 chars]",2024-12-01T17:10:28Z,https://gizmodo.com/billionaire-marc-benioff-owner-of-time-uses-magazine-to-promote-his-ai-software-2000531146
crypto,Yahoo Entertainment,Tobi Opeyemi Amure,4 Reasons To Invest In Crypto Before Trump’s Inauguration and 3 Reasons Not To,"Next year could be a big one for cryptocurrency, especially as President-elect Donald Trump returns to the White House. During his campaign, Trump promoted...","©PABLO GIANINAZZI/EPA-EFE / Shutterstock
Next year could be a big one for cryptocurrency, especially as President-elect Donald Trump returns to the White House. During his campaign, Trump promoted h… [+5259 chars]",2024-12-12T11:02:32Z,https://finance.yahoo.com/news/4-reasons-invest-crypto-trump-110232073.html
crypto,Ritholtz.com,Barry Ritholtz,At the Money: Matt Hougan on Responsible Crypto Investing,"﻿     At the Money: Crypto Curious. November 26, 2024 Are you crypto-curious? Are you interested in owning some bitcoin, Ethereum, or other crypto-coins? How can investors get exposure to the space? Full transcript below. ~~~ About this week’s guest: Matt Hou…","At the Money: Crypto Curious. November 26, 2024
Are you crypto-curious? Are you interested in owning some bitcoin, Ethereum, or other crypto-coins? How can investors get exposure to the space?
Full… [+17318 chars]",2024-11-26T14:00:42Z,https://ritholtz.com/2024/11/atm-crypto-investing/
crypto,Business Insider,fdemott@insider.com (Filip De Mott),"Stock market today: S&P 500, Dow end at record as investors shake off tariff fears, digest Fed minutes",Stock markets recovered on Tuesday after Trump's latest tariff plans briefly derailed equities.,"US stocks rose to records on Tuesday, as indexes recovered from Donald Trump's market-moving tariff plans announced Monday evening and as traders digested the minutes of the Federal Reserve's last me… [+2293 chars]",2024-11-26T21:21:11Z,https://markets.businessinsider.com/news/stocks/stock-market-today-trade-tariffs-trump-fed-minutes-rate-cuts-2024-11
crypto,Gizmodo.com,Todd Feathers,Investors Appear to Think Bluesky Crypto Firm Is the Bluesky Social Network,The social media platform Bluesky has grown from 12 million to more than 20 million users since the election.,"Bluesky is having a moment. No, not that Bluesky, the other one.
The Canadian crypto company Bluesky Digital Assets Corp has seen its stock take off, in a manner of speaking, over the past week as i… [+2317 chars]",2024-11-20T21:30:22Z,https://gizmodo.com/investors-appear-to-think-bluesky-crypto-firm-is-the-bluesky-social-network-2000527227
crypto,Gizmodo.com,Matt Novak,"Fake Uber Driver Charged With Stealing $223,000 in Crypto From Passengers",The alleged scammer picked up passengers in front of a hotel.,"A man in Scottsdale, Arizona, has been charged with stealing hundreds of thousands of dollars in crypto from victims who thought he was an Uber driver. Prosecutors have called it an “extremely sophis… [+2271 chars]",2024-12-13T20:14:42Z,https://gizmodo.com/fake-uber-driver-charged-with-stealing-223000-in-crypto-from-passengers-2000538534
crypto,ABC News,Max Zahn,"Trump takes credit for bitcoin surpassing $100,000. Is it too late to buy?",The price of bitcoin has soared nearly 50% since Election Day.,"The price of bitcoin topped $100,000 for the first time ever late Wednesday, and soared to a fresh high in early trading on Thursday.
The new gains extended a rally set off by the election of former… [+3958 chars]",2024-12-05T16:56:22Z,https://abcnews.go.com/Business/late-buy-bitcoin-after-hit-100000-experts-weigh/story?id=116479991
crypto,[Removed],,[Removed],[Removed],[Removed],2024-12-03T17:34:20Z,https://removed.com
crypto,Yahoo Entertainment,,Hawk Tuah girl wanted to reward fans with a memecoin—crypto insiders turned it into a ‘one-day pump and dump’,,"If you click 'Accept all', we and our partners, including 237 who are part of the IAB Transparency &amp; Consent Framework, will also store and/or access information on a device (in other words, use … [+678 chars]",2024-12-10T16:04:05Z,https://consent.yahoo.com/v2/collectConsent?sessionId=1_cc-session_ff4b3aa9-d828-478a-9316-619e22630dd6
crypto,Yahoo Entertainment,Muslim Farooque,Pantera's Morehead Sees Bitcoin Soaring to $740K Amid Policy Shifts and Skeptic Sentiment,"Dan Morehead predicts Bitcoin could hit $740,000, driven by policy shifts and Pantera's growing blockchain investments","According to Dan Morehead, managing partner and founding member of Pantera Capital Management, Bitcoin's (BTC) explosive climb still has a lot of room to grow.
Morehead dismissed worries of a Bitcoi… [+950 chars]",2024-11-26T15:09:50Z,https://finance.yahoo.com/news/panteras-morehead-sees-bitcoin-soaring-150950431.html
crypto,Daytona Beach News-Journal,"Frank Fernandez, Daytona Beach News-Journal",'King Bob' from Palm Coast facing additional federal charges in 'phishing scheme',Noah Michael Urban was already facing charges in federal court in Jacksonville. This week he was indicted by a federal grand jury in California.,"A Palm Coast man who called himself ""King Bob"" and was arrested earlier this year as part of a cryptocurrency heist of at least $800,000 is now facing additional federal charges as part of  a phishin… [+3732 chars]",2024-11-22T14:23:53Z,https://www.news-journalonline.com/story/news/crime/2024/11/22/king-bob-from-palm-coast-facing-more-federal-charges-in-crypto-heist/76493597007/
crypto,Business Insider,Jyoti Mann,OpenAI's CFO says it trusts Elon Musk to 'compete appropriately' after his ally David Sacks was appointed AI czar,OpenAI CFO Sarah Friar trusts Elon Musk to act in good faith despite his ally David Sacks' appointment as AI czar.,"Sarah Friar was appointed as OpenAI's chief financial officer in June.Brian Lawless - Pool/Getty Images
<ul><li>OpenAI's CFO trusts Elon Musk to prioritize the national interest despite owning a riv… [+2328 chars]",2024-12-11T12:40:57Z,https://www.businessinsider.com/openai-cfo-elon-musk-xai-david-sacks-ai-czar-trump-2024-12
crypto,BBC News,https://www.facebook.com/bbcnews,Bitcoin surges past $100k for first time,Its record price is making headlines - but that's just one part of the cryptocurrency's tumultuous story.,"2. Making history with pizza
Bitcoin now underpins a two trillion-dollar cryptocurrency industry - but the first recorded transaction using it was the purchase of pizza.
On 22 May 2010, Lazlo Hanye… [+1248 chars]",2024-12-05T08:54:47Z,https://www.bbc.co.uk/news/articles/cqj0wkwv1x2o
crypto,Theregister.com,Simon Sharwood,Binance accused of tax evasion by India's finance minister,"Nation wants almost $100 million from 17 crypto exchanges – most of it from Binance
India's Finance Ministry has alleged crypto exchange Binance evaded almost $85 million in tax – the vast majority of around $96 million it claims digi-dollar outfits haven't p…","India's Finance Ministry has alleged crypto exchange Binance evaded almost $85 million in tax the vast majority of around $96 million it claims digi-dollar outfits haven't paid.
Binance's alleged mi… [+2501 chars]",2024-12-04T05:27:07Z,https://www.theregister.com/2024/12/04/india_binance_crypto_tax_evasion/
crypto,Business Insider,Alice Tecotzky,The Trump Organization: Everything to know about the Trump family business,"The Trump family businesses have grown more sprawling over the years, touching everything from legacy real estate to cryptocurrency.","The Trump family businesses have been involved in everything from real estate to crypto.AP Photo/Evan Vucci
<ul><li>Trump took over the family real estate business in 1971 and used it to build his b… [+10814 chars]",2024-12-13T20:51:30Z,https://www.businessinsider.com/trump-organization
crypto,Yahoo Entertainment,,Government task force blocks crypto mining in multiple regions amid economic crisis: 'Uncontrolled',,"If you click 'Accept all', we and our partners, including 237 who are part of the IAB Transparency &amp; Consent Framework, will also store and/or access information on a device (in other words, use … [+678 chars]",2024-12-15T10:30:07Z,https://consent.yahoo.com/v2/collectConsent?sessionId=1_cc-session_b39a305c-b2fa-4c3e-ac13-6ae07d6bbe35
crypto,Yahoo Entertainment,,What Happened in Crypto Today: Ever Seen Wall Street Panic-Buy Something?,,"If you click 'Accept all', we and our partners, including 237 who are part of the IAB Transparency &amp; Consent Framework, will also store and/or access information on a device (in other words, use … [+678 chars]",2024-12-12T09:43:52Z,https://consent.yahoo.com/v2/collectConsent?sessionId=1_cc-session_4b44a9bd-c7de-4cbb-bbb5-07bb4124b323
crypto,Yahoo Entertainment,Shaurya Malwa,"XRP Tops $100B Market Cap, Reaches 2018 Levels, as Ripple’s RLUSD Close to Approval","The surge brought 7-day gains to 30%, outperforming bitcoin (BTC) and other majors, while 30-day gains stand at nearly 300%, data from CoinGecko show.","XRP flipped a $100 billion market capitalization late Saturday as a multiweek rally showed no signs of pausing amid multiple catalysts over the past weeks.
XRP zoomed nearly 10% in a 24-period from … [+1538 chars]",2024-12-01T11:20:03Z,https://finance.yahoo.com/news/xrp-tops-100b-market-cap-112003284.html
crypto,AppleInsider,news@appleinsider.com (Malcolm Owen),Coinbase Onboard adds Apple Pay for crypto purchases in third-party apps,"Coinbase has added Apple Pay support to its Onramp payment feature for third-party apps, making it easier for iPhone owners to buy cryptocurrency from their devices.Image credit: CoinbaseCoinbase Onramp is a tool for app developers that helps them enable user…","Coinbase has added Apple Pay support to its Onramp payment feature for third-party apps, making it easier for iPhone owners to buy cryptocurrency from their devices. 
Coinbase Onramp is a tool for a… [+2077 chars]",2024-12-02T21:07:16Z,https://appleinsider.com/articles/24/12/02/coinbase-onboard-adds-apple-pay-for-crypto-purchases-in-third-party-apps
crypto,VentureBeat,Rachel Kaser,Big Time PvP mode announced for December release following early access,"Big Time Studios is adding PvP gameplay to its NFT-based action-RPG title, Big Time, starting on December 2.","Big Time Studios announced this week when it plans to add PvP to its game Big Time. The new mode rolls out on December 2. Following the Preseason Phase, when the game was in closed beta, the studio i… [+1848 chars]",2024-11-27T21:31:38Z,https://venturebeat.com/games/big-time-pvp-mode-announced-for-december-release-following-early-access/
crypto,Business Insider,jsor@businessinsider.com (Jennifer Sor),"The Fed shouldn't cut rates as inflation is rising, markets are too frothy, JPMorgan Asset Management bond expert says","Traders see an 88% chance the Fed will cut rates another quarter-point in December, according to CME FedWatch.","The Federal Reserve may not have as much room to cut interest rates as it thinks, and central bankers would be better off skipping another decrease in December, according to one JPMorgan bond expert.… [+2624 chars]",2024-12-06T19:59:44Z,https://www.businessinsider.com/fed-rate-cuts-outlook-inflation-economy-stock-market-prices-jpmorgan-2024-12
crypto,Business Insider,jsor@businessinsider.com (Jennifer Sor),"There are 2 looming risks that could spark a serious correction for the stock market, Moody's chief economist says","High stock prices mean the risk of a market correction is rising, Moody's Mark Zandi said.","Investors hoping for another stellar year for the stock market should stay cautious with risks on the horizon in 2025. 
US stocks could see a significant correction, thanks to high asset prices and … [+3694 chars]",2024-12-04T17:51:07Z,https://markets.businessinsider.com/news/stocks/stock-market-prediction-sp500-2025-outlook-correction-trump-tariffs-deportation-2024-12
crypto,The Next Web,Siôn Geschwindt,"Upvest — which powers stock trading on Revolut, N26, Bunq — secures €100M","If you live in Europe and you use a neobank, you’ve likely been interacting with Upvest’s investment products without even knowing it. The Berlin-based startup runs a stock-trading API that integrates into some of the biggest fintechs in Europe — Revolut, N26…","If you live in Europe and you use a neobank, youve likely been interacting with Upvests investment products without even knowing it.
The Berlin-based startup runs a stock-trading API that integrates… [+2386 chars]",2024-12-12T09:50:23Z,https://thenextweb.com/news/upvest-which-powers-stock-trading-on-revolut-n26-bunq-secures-e100m
crypto,HYPEBEAST,info@hypebeast.com (Hypebeast),"Unboxing: The User-Friendly Yet Secure Crypto Wallet, Ledger Stax","The latest generation of Ledger’s digital asset security has been centered around the release of the innovative Ledger Stax and Ledger Flex. Of the two wallet-style devices, the Ledger Stax model – revealed first in 2022 – has pioneered the brand’s secure tec…","The latest generation of Ledgers digital asset security has been centered around the release of the innovative Ledger Stax and Ledger Flex. Of the two wallet-style devices, the Ledger Stax model reve… [+1277 chars]",2024-11-28T14:48:12Z,https://hypebeast.com/2024/11/ledger-stax-crypto-wallet-unboxing-video
crypto,HYPEBEAST,info@hypebeast.com (Hypebeast),Unboxing: On-the-Go Crypto Security Starts with Ledger Flex,"In light of Ledger’s 10th anniversary, Hypebeast takes a deep dive into its next generation of crypto wallets, discovering how advancements in interface and physical design are supplementing users with top-end asset security.Having recently captured the user-…","In light of Ledgers 10th anniversary, Hypebeast takes a deep dive into its next generation of crypto wallets, discovering how advancements in interface and physical design are supplementing users wit… [+1152 chars]",2024-12-12T12:36:41Z,https://hypebeast.com/2024/12/ledger-flex-crypto-wallet-unboxing-video
