topic,source,author,title,description,content,published_at,url
dry bulk shipping,Naftemporiki.gr,Αλεξία Σωτηρίου,Greek shipowners place new orders worth 1.6 billion dollars,"The order book of Greek interests in Asian shipyards is constantly expanding. In the last ten days, brokers from Greece and abroad have recorded 16 new orders from five Greek-owned…
Greek shipowners place new orders worth 1.6 billion dollars - Η ΝΑΥΤΕΜΠΟΡΙΚΗ","The order book of Greek interests in Asian shipyards is constantly expanding. In the last ten days, brokers from Greece and abroad have recorded 16 new orders from five Greek-owned companies, worth 1… [+1812 chars]",2024-11-25T06:17:36Z,https://www.naftemporiki.gr/english/1836525/greek-shipowners-place-new-orders-worth-1-6-billion-dollars/
dry bulk shipping,GlobeNewswire,Verified Market Research,"Automotive Logistics Market is expected to generate a revenue of USD 634.26 Billion by 2030, Globally, at 6.3% CAGR: Verified Market Research®","Verified Market Research® a leading provider of business intelligence and market analysis is thrilled to announce the release of its comprehensive and authoritative report on the, "" Automotive Logistics Market Size and Forecast,"". As the automotive industry u…","Lewes, Delaware, Nov. 27, 2024 (GLOBE NEWSWIRE) -- The Global Automotive Logistics Market Size is projected to grow at a CAGR of 6.3% from 2024 to 2030, according to a new report published by Verifie… [+11640 chars]",2024-11-27T15:00:00Z,https://www.globenewswire.com/news-release/2024/11/27/2988282/0/en/Automotive-Logistics-Market-is-expected-to-generate-a-revenue-of-USD-634-26-Billion-by-2030-Globally-at-6-3-CAGR-Verified-Market-Research.html
dry bulk shipping,New York Post,P.J. McCormick,Walmart Black Friday sale 2024: Biggest deals of the year on TVs and more,"Walmart shoppers, start your engines...Black Friday is here!","New York Post may be compensated and/or receive an affiliate commission if you buy through our links. Featured pricing is subject to change.
The “official” Black Friday may still be a few days away,… [+62120 chars]",2024-11-25T16:59:00Z,https://nypost.com/shopping/best-walmart-black-friday-deals-sales-2024/
dry bulk shipping,New York Post,P.J. McCormick,"We found Walmart’s Black Friday deals on laptops, TVs, vacuums and more","Walmart shoppers, start your engines...Black Friday is here!","New York Post may be compensated and/or receive an affiliate commission if you buy through our links. Featured pricing is subject to change.
The “official” Black Friday may still be a few days away,… [+56624 chars]",2024-11-27T15:11:00Z,https://nypost.com/shopping/best-walmart-black-friday-deals-sales-2024-11-27/
dry bulk shipping,New York Post,P.J. McCormick,"The very best Walmart Black Friday deals we found: MacBook, Dyson Airwrap, PS5, more","Walmart shoppers, start your engines...Black Friday is here!","New York Post may be compensated and/or receive an affiliate commission if you buy through our links. Featured pricing is subject to change.
The “official” Black Friday may still be a few days away,… [+57946 chars]",2024-11-28T18:07:00Z,https://nypost.com/shopping/best-walmart-black-friday-deals-sales-2024-11-28/
dry bulk shipping,New York Post,P.J. McCormick,"The very best Walmart Black Friday deals 2024: AirPods, PS5, more on sale","Walmart shoppers, start your engines...Black Friday is here!","New York Post may be compensated and/or receive an affiliate commission if you buy through our links. Featured pricing is subject to change.
The “official” Black Friday may still be a few days away,… [+58519 chars]",2024-11-29T12:28:00Z,https://nypost.com/shopping/best-walmart-black-friday-deals-sales-2024-11-29/
dry bulk shipping,Harvard School of Engineering and Applied Sciences,,Republican-Led States v. The Big Three: Complaint,"INTRODUCTION 1. For the past four years, America’s coal producers have been responding not to the price signals of the free market, but to the commands of Larry Fink, BlackRock’s Chairman and CEO, and his fellow asset managers. As demand for the electricity A…","INTRODUCTION
1. For the past four years, Americas coal producers have been responding not to the price signals of the free market, but to the commands of Larry Fink, BlackRocks Chairman and CEO, and… [+172521 chars]",2024-12-03T14:32:11Z,https://corpgov.law.harvard.edu/2024/12/03/republican-led-states-v-the-big-three-complaint/
dry bulk shipping,Naftemporiki.gr,Αλεξία Σωτηρίου,The winners of the Lloyd’s List Greek Shipping Awards,"The Lloyd’s List Greek Shipping Awards took place on Friday, December 6.
The event presented 20 awards to individuals, companies or organizations for achievements in the shipping industry during the…
The winners of the Lloyd’s List Greek Shipping Awards - Η Ν…","The Lloyds List Greek Shipping Awards took place on Friday, December 6.
The event presented 20 awards to individuals, companies or organizations for achievements in the shipping industry during the … [+1159 chars]",2024-12-09T07:35:56Z,https://www.naftemporiki.gr/english/1850696/the-winners-of-the-lloyds-list-greek-shipping-awards/
dry bulk shipping,Rigzone,Jov Onsat,BW LPG Receives Fifth VLGC under $1 Billion Deal with Avance Gas,BW LPG took delivery of the fifth of 12 VLGCs sold to the shipper under a $1 billion stock-and-cash transaction with Avance Gas.,"BW LPG Ltd. has taken delivery of the fifth of 12 very large gas carriers (VLGCs) sold to the liquefied petroleum gas (LPG) shipper under a stock-and-cash transaction with Avance Gas Holdings Ltd.
A… [+4614 chars]",2024-12-03T11:23:39Z,https://www.rigzone.com/news/bw_lpg_receives_fifth_vlgc_under_1_billion_deal_with_avance_gas-03-dec-2024-178923-article/
dry bulk shipping,Lemis.com,Greg's diary,VicEmergency grumblings,"I've grumbled about Emergency.Vic or
VicEmergency or whatever they want to be called for multiple reasons, and currently they're
scaring us because there's a thunderstorm. What, right here in Dereel? Well, no, about half the state of
Victoria, an area of abou…","As always, I used Google Maps for the trip. Annoyingly, as so often, it had forgotten the detailed itinerary that I
had sent yesterday, but it was really helpful getting off the freeway, showing the… [+64127 chars]",2024-11-28T05:31:12Z,http://www.lemis.com/grog/diary-nov2024.php?topics=c#D-20241128-003112
dry bulk shipping,Lemis.com,Greg's diary,Exif: not out of the woods,"Somehow I haven't solved all my Exif problems. Here another one:
 


 

 
=== grog@hydra (/dev/pts/25)
 ~/Photos/20241126
 1407
 -> geotag *.jpeg
Warning: [minor] File contains multi-segment EXIF - Sichuan-pepper-1.jpeg
Error: Can't write multi-segment EX…","As always, I used Google Maps for the trip. Annoyingly, as so often, it had forgotten the detailed itinerary that I
had sent yesterday, but it was really helpful getting off the freeway, showing the… [+64127 chars]",2024-11-30T06:36:05Z,http://www.lemis.com/grog/diary-nov2024.php?topics=c#D-20241130-013605
dry bulk shipping,Lemis.com,Greg's diary,Your accout is tempory suspend,"Another strange mail message today:
 


 

 
37 N + 25-11-2024 To groggyhim@lemis.c ( 387) PayPal-Sicherheit    N + Ihr Konto ist vorubergehend eingeschrankt
 





 
PayPal securty? ?Ihr Konto ist
vorubergehend eingeschrankt? doesn't really mean anything.…","As always, I used Google Maps for the trip. Annoyingly, as so often, it had forgotten the detailed itinerary that I
had sent yesterday, but it was really helpful getting off the freeway, showing the… [+64127 chars]",2024-11-26T05:52:10Z,http://www.lemis.com/grog/diary-nov2024.php?topics=c#D-20241126-005210
dry bulk shipping,Lemis.com,Greg's diary,Still more git pain,"Recently I've had trouble with my git controlled source trees again. I changed something in the ports tree,
and git objected next time I tried to update it, suggesting that I
use git merge --no-ff or git rebase. I've seen that
before, and I thought that it
ha…","As always, I used Google Maps for the trip. Annoyingly, as so often, it had forgotten the detailed itinerary that I
had sent yesterday, but it was really helpful getting off the freeway, showing the… [+64127 chars]",2024-11-30T06:28:15Z,http://www.lemis.com/grog/diary-nov2024.php?topics=c#D-20241130-012815
dry bulk shipping,Lemis.com,Greg's diary,AI explains kernel techniques,"Warren Toomey posted this message on the
COFF mailing list
today:
 


 
 
 A spin lock, also known as a spinning lock or spinning lock mechanism, is a type of
 mechanical locking device used to secure and protect sensitive electronic components, such
 as mic…","As always, I used Google Maps for the trip. Annoyingly, as so often, it had forgotten the detailed itinerary that I
had sent yesterday, but it was really helpful getting off the freeway, showing the… [+64127 chars]",2024-11-29T07:08:14Z,http://www.lemis.com/grog/diary-nov2024.php?topics=c#D-20241129-020814
dry bulk shipping,Lemis.com,Greg's diary,Bloody security!,"Woke up this morning to discover that albo.lemis.com, my mobile phone, had updated
its Androidoperating system without asking. Security updates! That scares me.
 


 
In principle, of course, security is good. But the way they go about it almost invariably
b…","As always, I used Google Maps for the trip. Annoyingly, as so often, it had forgotten the detailed itinerary that I
had sent yesterday, but it was really helpful getting off the freeway, showing the… [+64127 chars]",2024-11-28T04:13:01Z,http://www.lemis.com/grog/diary-nov2024.php?topics=c#D-20241127-231301
dry bulk shipping,Lemis.com,Greg's diary,Australia Post advice,"Message from Australia Post today, something like ?You have mail?. But this time I read the fine print:
 


 
 
 Australia Post will never send you an unsolicited email asking for your password, credit
 card details or account information.
 



 Protect you…","As always, I used Google Maps for the trip. Annoyingly, as so often, it had forgotten the detailed itinerary that I
had sent yesterday, but it was really helpful getting off the freeway, showing the… [+64127 chars]",2024-11-30T04:57:43Z,http://www.lemis.com/grog/diary-nov2024.php?topics=c#D-20241129-235743
dry bulk shipping,CNN,Kristen Rogers,How to afford a great Christmas if money’s tight this year | CNN,"Amid inflation-related financial struggles, there are ways to enjoy Christmas decorations, gifts, meals and activities without breaking the bank.","Sign up for CNNs Adulthood, But Better newsletter series. Our seven-part guide has helpful hints for paying off student loans, negotiating your salary, building credit, and more.
The holidays are of… [+10420 chars]",2024-12-06T00:39:59Z,https://www.cnn.com/2024/12/05/health/how-to-celebrate-christmas-on-a-budget-wellness/index.html
tanker shipping,Business Insider,Huileng Tan,A severe oil spill shows the dangers of Russia's dark fleet,The Volgoneft 212 and Volgoneft 239 vessels were damaged during a heavy storm on Sunday.,"This photo taken from a video released by the Russian Southern Transport Prosecutor's Office, shows the Volgoneft-212 tanker wrecked by a storm in the Kerch Strait, Russia on Sunday, Dec 15, 2024.The… [+3262 chars]",2024-12-17T09:43:45Z,https://www.businessinsider.com/russia-economy-massive-oil-spill-dark-shadow-fleet-dangers-sanctions-2024-12
tanker shipping,Al Jazeera English,Shola Lawal,The Russian tanker disaster and an oil leak in Kerch Strait: What it means,"During wartime, the effects on the environment from such accidents are likely to be far worse than usual.","Two Russian ships damaged in stormy weather over the weekend have spilled about 3,700 tons (3,350 tonnes) of low-grade fuel into the Kerch Strait in Russian-occupied Crimea, Russian state media repor… [+11680 chars]",2024-12-19T09:32:46Z,https://www.aljazeera.com/news/2024/12/19/the-russian-tanker-disaster-and-an-oil-leak-in-kerch-strait-what-it-means
tanker shipping,Al Jazeera English,Avinash Persaud,It’s time to tax fossil fuels and shipped goods to fund climate resilience,Climate-stricken regions are sinking into debt. We can stop that by financing the loss and damage fund through levies.,"A few days after the UN Climate Change Conference in Baku concluded, I reflected on the consequences of Hurricane Beryl ripping through the Caribbean five months ago. In its wake, Grenada, which was … [+5068 chars]",2024-12-01T14:27:25Z,https://www.aljazeera.com/opinions/2024/12/1/its-time-to-tax-fossil-fuels-and-shipped-goods-to-fund-climate-resilience
tanker shipping,[Removed],,[Removed],[Removed],[Removed],2024-12-17T12:36:46Z,https://removed.com
tanker shipping,Yahoo Entertainment,Associated Press Finance,"Damaged Russian ships spilled an estimated 3,700 tons of oil in Kerch Strait, state media says","An estimated 3,700 tons of low-grade fuel oil has spilled into the Kerch Strait after two Russian ships were seriously damaged by stormy weather, Russian...","Yahoo is using AI to generate takeaways from this article. This means the info may not always match what's in the article. Reporting mistakes helps us improve the experience.Generate Key Takeaways
M… [+1806 chars]",2024-12-16T14:55:12Z,https://www.yahoo.com/news/damaged-russian-ships-spilled-estimated-145512913.html
tanker shipping,International Business Times,Elizabeth Urban,"WATCH: Horrifying Moment Russian Oil Tanker Split in Half by Storm Sinks, Spilling Oil Into Black Sea",The aftermath of a Russian oil tanker splitting in half because of a storm was caught on camera as the ship began to sink and oil spilt into the Black Sea.,"The aftermath of a Russian oil tanker splitting in half because of a storm was caught on camera as the ship began to sink and oil spilt into the Black Sea.
Video captured and shared to social media … [+1170 chars]",2024-12-15T18:44:41Z,https://www.ibtimes.com/watch-horrifying-moment-russian-oil-tanker-split-half-storm-sinks-spilling-oil-black-sea-3755566
tanker shipping,gcaptain.com,Mike Schuler,Frontline CEO Warns of Shadow Fleet’s Impact on Tanker Market,Frontline plc posted a profit of $60.5 million in the third quarter of 2024 despite challenging market conditions. The tanker shipping giant reported revenues of $490.3 million. The company’s adjusted...,"Frontline plc posted a profit of $60.5 million in the third quarter of 2024 despite challenging market conditions.
The tanker shipping giant reported revenues of $490.3 million. The company’s adjust… [+2425 chars]",2024-11-27T16:15:51Z,https://gcaptain.com/frontline-ceo-warns-of-shadow-fleets-impact-on-tanker-market/
tanker shipping,VOA News,webdesk@voanews.com (Reuters),Rescue underway for damaged Russian oil tankers in Kerch Strait,"MOSCOW — A Russian oil tanker carrying thousands of tons of oil products split apart during a heavy storm Sunday, spilling oil into the Kerch Strait, while another tanker was also in distress after sustaining damage, Russian officials said.


An emergency res…","MOSCOW  A Russian oil tanker carrying thousands of tons of oil products split apart during a heavy storm Sunday, spilling oil into the Kerch Strait, while another tanker was also in distress after su… [+2669 chars]",2024-12-15T14:08:21Z,https://www.voanews.com/a/rescue-underway-for-damaged-russian-oil-tankers-in-kerch-strait-/7901948.html
tanker shipping,The National Interest ,Peter Suciu,The Great Houthi-U.S. Navy War of 2024 Now Over?,"The United States Navy currently has no aircraft deployed in the Middle East, as the Nimitz-class nuclear-powered USS Abraham Lincoln (CVN-73) departed the region last month while USS Harry S. Truman (CVN-75) arrived in Marseille, France, on Saturday for a be…","The United States Navy currently has no aircraft deployed in the Middle East, as the Nimitz-class nuclear-powered USS Abraham Lincoln (CVN-73) departed the region last month while USS Harry S. Truman… [+3408 chars]",2024-12-08T15:21:05Z,https://nationalinterest.org/blog/buzz/great-houthi-us-navy-war-2024-now-over-214012
tanker shipping,Newsweek,Flynn Nicholls,Russian Ship 'Split in Half' by Storms Near Crimea: Reports,"Russian authorities confirmed that there was a rescue operation for two vessls, one of which was carrying over 4,000 tons of fuel oil.","A Russian oil tanker reportedly split in half and another sustained damage from powerful waves near Kerch in the Black Sea off the coast of Crimea on Sunday.
Russian authorities confirmed that there… [+3058 chars]",2024-12-15T11:41:13Z,https://www.newsweek.com/russian-ship-split-half-storms-near-crimea-reports-2001002
tanker shipping,Newsweek,Brendan Cole,Putin's Shadow Fleet Dealt New Blow in Disaster-Riddled Week,The vessel Mercury broke down in the Pacific Ocean amid concerns about the seaworthiness of Russian vessels.,"What's New
A Russian tanker with 19 crew aboard broke down due to engine failure in the Pacific Ocean in the fourth incident involving Russia's ships in the last week. Newsweek has contacted Russia'… [+5451 chars]",2024-12-18T11:30:40Z,https://www.newsweek.com/russia-pacific-ocean-ship-sink-2002591
tanker shipping,gcaptain.com,GCaptain,Malaysia-based UNI-FLEET Chooses ABS Wavesight Nautical Systems™ to Optimize Maintenance and Purchasing Operations,"ABS Wavesight™, the ABS-affiliated Software-as-a-Service company, is pleased to announce that UNI-FLEET SDN BHD, a specialized shipping company operating tanker vessels primarily focused on the transportation of ammonia across Asia,...","ABS Wavesight, the ABS-affiliated Software-as-a-Service company, is pleased to announce that UNI-FLEET SDN BHD, a specialized shipping company operating tanker vessels primarily focused on the transp… [+1594 chars]",2024-12-18T16:37:05Z,https://gcaptain.com/malaysia-based-uni-fleet-chooses-abs-wavesight-nautical-systems-to-optimize-maintenance-and-purchasing-operations/
tanker shipping,Naturalnews.com,Richard Brown,U.S. Navy destroyers successfully repel Houthi missile and drone attacks in Gulf of Aden,"Over the weekend, two Navy destroyers –  USS Stockdale (DDG 106) and USS O’Kane (DDG 77) – successfully repelled missile and drone attacks launched by northern Yemen’s Houthi rebels targeting American vessels in the Red Sea. The confrontation occurred between…","Over the weekend, two Navy destroyers   USS Stockdale (DDG 106) and USS OKane (DDG 77)  successfully repelled missile and drone attacks launched by northern Yemen's Houthi rebels targeting American v… [+3957 chars]",2024-12-06T06:00:00Z,https://www.naturalnews.com/2024-12-06-navy-destroyers-repel-houthi-missile-drone-attack.html
tanker shipping,gcaptain.com,Bloomberg,Sanctioned Russia Oil Tanker Turns Back From Detour Around UK,A tanker hauling Russian crude from the Baltic Sea to India that was observed heading toward the Shetland Islands — a route that would have taken it on a detour around the northern tip of the UK — made a sudden turn and instead took a more-typical journey thr…,"By Julian Lee
Dec 9, 2024 (Bloomberg) A tanker hauling Russian crude from the Baltic Sea to India that was observed heading toward the Shetland Islands a route that would have taken it on a detour a… [+1538 chars]",2024-12-09T11:49:28Z,https://gcaptain.com/sanctioned-russia-oil-tanker-turns-back-from-detour-around-uk/
tanker shipping,VOA News,webdesk@voanews.com (Reuters),"US imposes sanctions on Iran, Houthi-related targets","The United States imposed sanctions on Thursday on Iran and Houthi-related entities, according to the Treasury Department website which listed a number of individuals, companies and vessels that had been targeted.  


The sanctions target three vessels involv…","The United States imposed sanctions on Thursday on Iran and Houthi-related entities, according to the Treasury Department website which listed a number of individuals, companies and vessels that had … [+1572 chars]",2024-12-19T19:22:58Z,https://www.voanews.com/a/us-imposes-sanctions-on-iran-houthi-related-targets/7907399.html
tanker shipping,gcaptain.com,Malte Humpert,EU Imposes First-Ever Sanctions On Yamal Gas Project Targeting ‘Christophe de Margerie’ LNG Carrier,"The EU’s 15th sanctions package against Russia for the first time targets Yamal LNG by including a carrier in service of the project.  The ice-capable tanker Christophe de Margerie, one...","The EUs 15th sanctions package against Russia for the first time targets Yamal LNG by including a carrier in service of the project. 
The ice-capable tanker Christophe de Margerie, one of fifteen Ar… [+2227 chars]",2024-12-16T18:14:09Z,https://gcaptain.com/eu-imposes-first-ever-sanctions-on-yamal-gas-project-targeting-christophe-de-margerie-lng-carrier/
tanker shipping,gcaptain.com,Bloomberg,Blacklisted Tanker Avoids English Channel as UK Expands Sanctions Enforcement,"A tanker hauling Russian crude from the Baltic Sea to India is taking an unusually long route around the UK, just as Britain expands sanctions against Russia’s energy industry.","By Julian Lee (Bloomberg) —
A tanker hauling Russian crude from the Baltic Sea to India is taking an unusually long route around the UK, just as Britain expands sanctions against Russias energy indu… [+1873 chars]",2024-12-03T20:45:28Z,https://gcaptain.com/blacklisted-tanker-avoids-english-channel-as-uk-expands-sanctions-enforcement/
tanker shipping,gcaptain.com,Malte Humpert,Arctic Shipping Sets New Records With Hundred Transit Voyages Carrying 3m Tonnes of Cargo in 2024,A tanker hauling Russian crude from the Baltic Sea to India that was observed heading toward the Shetland Islands — a route that would have taken it on a detour around the northern tip of the UK — made a sudden turn and instead took a more-typical journey thr…,"By Malte Humpert (gCaptain) 
Even in the face of widening Western sanctions Russia managed to increase Arctic transit cargo by almost 50 percent over 2023. Its main Arctic shipping lane, the Norther… [+3220 chars]",2024-12-09T12:01:30Z,https://gcaptain.com/arctic-shipping-sets-new-records-with-hundred-transit-voyages-carrying-3m-tonnes-of-cargo-in-2024/
tanker shipping,gcaptain.com,Bloomberg,What It’s Like to Captain a Tanker on Fire After a Houthi Attack,Captain Avhilash Rawat had just finished dinner when an anti-ship ballistic missile smashed into his oil tanker.,"By Jack Wittels
Dec 4, 2024 (Bloomberg) Captain Avhilash Rawat had just finished dinner when an anti-ship ballistic missile smashed into his oil tanker.
The whole vessel shook, he said, in an inter… [+3689 chars]",2024-12-04T11:17:10Z,https://gcaptain.com/what-its-like-to-captain-a-tanker-on-fire-after-a-houthi-attack/
tanker shipping,Globalsecurity.org,John Pike,Environmentalists Warn Of Disaster As Russian Officials Race To Grounded Tankers In Kerch Strait,Environmentalists are warning of a potential disaster posed by two Russian oil tankers that ran aground in the ecologically sensitive waters off Ukraine's Moscow-annexed Crimean coastline as local media reported thousands of tons of low-grade fuel has spilled…,"By RFE/RL's Russian Service December 16, 2024
Environmentalists are warning of a potential disaster posed by two Russian oil tankers that ran aground in the ecologically sensitive waters off Ukraine… [+5686 chars]",2024-12-17T10:13:27Z,https://www.globalsecurity.org/wmd/library/news/ukraine/2024/12/ukraine-241216-rferl02.htm
tanker shipping,Newsweek,Matthew Impelli,Russia's 'Ghost Fleet' of Oil Ships Face New Round of EU Sanctions,The sanctions target around 50 ships operating illegally to evade restrictions.,"Russia's ""Ghost Fleet"" of oil tankers are facing a new round of sanctions from the European Union (EU) amid the ongoing war with Ukraine.
EU envoys have approved a new package of sanctions against R… [+3199 chars]",2024-12-11T20:08:54Z,https://www.newsweek.com/russia-ghost-fleet-oil-ships-new-sanctions-european-union-1999397
tanker shipping,gcaptain.com,Mike Schuler,U.S. Navy Destroyers Thwart Multiple Houthi Attacks on American Ships,Two U.S. Navy destroyers successfully defended against multiple Houthi-launched attacks while escorting American merchant vessels through the Gulf of Aden between November 30 and December 1. The Arleigh Burke-class guided-missile...,"Two U.S. Navy destroyers successfully defended against multiple Houthi-launched attacks while escorting American merchant vessels through the Gulf of Aden between November 30 and December 1.
The Arl… [+1262 chars]",2024-12-02T03:33:38Z,https://gcaptain.com/u-s-navy-destroyers-thwart-multiple-houthi-attacks-on-american-ships/
tanker shipping,Globalsecurity.org,John Pike,Treasury Maintains Pressure on Iranian Shadow Fleet,"Today, the United States Department of the Treasury is imposing sanctions on four entities and three vessels involved in the trade of Iranian petroleum and petrochemicals, which generate billions of dollars' worth of revenue for the Iranian regime. This reven…","U.S. Department of the Treasury
December 19, 2024 
WASHINGTON -- Today, the United States Department of the Treasury is imposing sanctions on four entities and three vessels involved in the trade o… [+7758 chars]",2024-12-20T08:16:05Z,https://www.globalsecurity.org/wmd/library/news/iran/2024/iran-241219-treasury01.htm
