topic,source,author,title,description,content,published_at,url
LNG shipping,gcaptain.com,Mike Schuler,EU Expands Maritime Sanctions: 52 New Vessels Added to Russia’s Shadow Fleet Blacklist,"The European Union has unveiled its 15th package of restrictive measures, specifically targeting Putin’s shadow fleet and maritime circumvention efforts. The latest sanctions package introduces port access bans and service...","The European Union has unveiled its 15th package of restrictive measures, specifically targeting Putin’s shadow fleet and maritime circumvention efforts.
The latest sanctions package introduces port… [+1743 chars]",2024-12-16T16:17:01Z,https://gcaptain.com/eu-expands-maritime-sanctions-52-new-vessels-added-to-russias-shadow-fleet-blacklist/
LNG shipping,BusinessLine,BL Mangaluru Bureau,Centre drops two key Project UNNATI initiatives at New Mangalore Port,"The plans for establishing an LNG terminal and a mechanised fertiliser handling berth were dropped due to the lack of a sterile area for the terminal and negative market response, respectively","The Centre has said that two initiatives from Project UNNATI have been dropped at New Mangalore Port.
In a written reply to Kota Srinivasa Poojary, Member of Parliament from Udupi-Chikkamagaluru, Sa… [+1462 chars]",2024-12-07T12:31:54Z,https://www.thehindubusinessline.com/economy/logistics/centre-drops-two-key-project-unnati-initiatives-at-new-mangalore-port/article68958720.ece
LNG shipping,ETF Daily News,MarketBeat News,State Street Corp Increases Position in Golar LNG Limited (NASDAQ:GLNG),"State Street Corp lifted its position in shares of Golar LNG Limited (NASDAQ:GLNG – Free Report) by 5.2% in the 3rd quarter, according to the company in its most recent 13F filing with the Securities and Exchange Commission. The fund owned 1,920,590 shares of…","State Street Corp lifted its position in shares of Golar LNG Limited (NASDAQ:GLNG – Free Report) by 5.2% in the 3rd quarter, according to the company in its most recent 13F filing with the Securities… [+3928 chars]",2024-12-18T08:43:00Z,https://www.etfdailynews.com/2024/12/18/state-street-corp-increases-position-in-golar-lng-limited-nasdaqglng/
LNG shipping,gcaptain.com,Mike Schuler,Hapag-Lloyd Secures Green Methanol Supply for Retrofitted Containerships,"Hapag-Lloyd has secured a major agreement with Beijing-based clean energy provider Goldwind for the annual supply of 250,000 tonnes of green methanol. The deal marks a crucial step in the...","Hapag-Lloyd has secured a major agreement with Beijing-based clean energy provider Goldwind for the annual supply of 250,000 tonnes of green methanol.
The deal marks a crucial step in the shipping g… [+1589 chars]",2024-11-29T17:19:58Z,https://gcaptain.com/hapag-lloyd-secures-green-methanol-supply-for-retrofitted-containerships/
LNG shipping,ETF Daily News,MarketBeat News,"UBS AM a distinct business unit of UBS ASSET MANAGEMENT AMERICAS LLC Purchases 32,751 Shares of Golar LNG Limited (NASDAQ:GLNG)","UBS AM a distinct business unit of UBS ASSET MANAGEMENT AMERICAS LLC raised its position in Golar LNG Limited (NASDAQ:GLNG – Free Report) by 20.2% during the third quarter, according to its most recent disclosure with the Securities and Exchange Commission. T…","UBS AM a distinct business unit of UBS ASSET MANAGEMENT AMERICAS LLC raised its position in Golar LNG Limited (NASDAQ:GLNG – Free Report) by 20.2% during the third quarter, according to its most rece… [+4598 chars]",2024-12-10T08:46:59Z,https://www.etfdailynews.com/2024/12/10/ubs-am-a-distinct-business-unit-of-ubs-asset-management-americas-llc-purchases-32751-shares-of-golar-lng-limited-nasdaqglng/
LNG shipping,ETF Daily News,MarketBeat News,Golar LNG Limited (NASDAQ:GLNG) Receives $49.63 Average Target Price from Brokerages,"Golar LNG Limited (NASDAQ:GLNG – Get Free Report) has received a consensus rating of “Moderate Buy” from the five ratings firms that are currently covering the stock, Marketbeat Ratings reports. One analyst has rated the stock with a hold recommendation and f…","Golar LNG Limited (NASDAQ:GLNG – Get Free Report) has received a consensus rating of “Moderate Buy” from the five ratings firms that are currently covering the stock, Marketbeat Ratings reports. One … [+3741 chars]",2024-12-13T06:10:52Z,https://www.etfdailynews.com/2024/12/13/golar-lng-limited-nasdaqglng-receives-49-63-average-target-price-from-brokerages/
LNG shipping,ETF Daily News,MarketBeat News,The Manufacturers Life Insurance Company Trims Stock Holdings in Golar LNG Limited (NASDAQ:GLNG),"The Manufacturers Life Insurance Company lowered its stake in shares of Golar LNG Limited (NASDAQ:GLNG – Free Report) by 2.5% during the 3rd quarter, according to the company in its most recent disclosure with the Securities and Exchange Commission (SEC). The…","The Manufacturers Life Insurance Company lowered its stake in shares of Golar LNG Limited (NASDAQ:GLNG – Free Report) by 2.5% during the 3rd quarter, according to the company in its most recent discl… [+4326 chars]",2024-12-12T08:10:56Z,https://www.etfdailynews.com/2024/12/12/the-manufacturers-life-insurance-company-trims-stock-holdings-in-golar-lng-limited-nasdaqglng/
LNG shipping,ETF Daily News,MarketBeat News,Charles Schwab Investment Management Inc. Has $13.20 Million Stock Position in Golar LNG Limited (NASDAQ:GLNG),"Charles Schwab Investment Management Inc. lessened its position in shares of Golar LNG Limited (NASDAQ:GLNG – Free Report) by 14.0% during the 3rd quarter, according to its most recent filing with the Securities and Exchange Commission. The institutional inve…","Charles Schwab Investment Management Inc. lessened its position in shares of Golar LNG Limited (NASDAQ:GLNG – Free Report) by 14.0% during the 3rd quarter, according to its most recent filing with th… [+4325 chars]",2024-12-09T08:12:52Z,https://www.etfdailynews.com/2024/12/09/charles-schwab-investment-management-inc-has-13-20-million-stock-position-in-golar-lng-limited-nasdaqglng/
LNG shipping,ETF Daily News,MarketBeat News,"COSCO SHIPPING Energy Transportation Co., Ltd. (OTCMKTS:CSDXF) Short Interest Up 142.0% in November","COSCO SHIPPING Energy Transportation Co., Ltd. (OTCMKTS:CSDXF – Get Free Report) saw a large growth in short interest in November. As of November 30th, there was short interest totalling 2,133,900 shares, a growth of 142.0% from the November 15th total of 881…","COSCO SHIPPING Energy Transportation Co., Ltd. (OTCMKTS:CSDXF – Get Free Report) saw a large growth in short interest in November. As of November 30th, there was short interest totalling 2,133,900 sh… [+1277 chars]",2024-12-14T07:36:58Z,https://www.etfdailynews.com/2024/12/14/cosco-shipping-energy-transportation-co-ltd-otcmktscsdxf-short-interest-up-142-0-in-november/
LNG shipping,ETF Daily News,MarketBeat News,Head to Head Contrast: Viking (NYSE:VIK) & FLEX LNG (NYSE:FLNG),"FLEX LNG (NYSE:FLNG – Get Free Report) and Viking (NYSE:VIK – Get Free Report) are both transportation companies, but which is the better business? We will compare the two companies based on the strength of their earnings, institutional ownership, dividends, …","FLEX LNG (NYSE:FLNG – Get Free Report) and Viking (NYSE:VIK – Get Free Report) are both transportation companies, but which is the better business? We will compare the two companies based on the stre… [+3544 chars]",2024-12-14T06:06:54Z,https://www.etfdailynews.com/2024/12/14/head-to-head-contrast-viking-nysevik-flex-lng-nyseflng/
LNG shipping,Financial Post,Bloomberg News,Natural Gas Exporter Venture Global Files for IPO,"Venture Global Inc., one of the biggest suppliers of liquefied natural gas in the US, filed for what could be one of the largest initial public offerings of 2025.","(Bloomberg) Venture Global Inc., one of the biggest suppliers of liquefied natural gas in the US, filed for what could be one of the largest initial public offerings of 2025.
The company wont make p… [+2983 chars]",2024-12-20T20:22:29Z,https://financialpost.com/pmn/business-pmn/natural-gas-exporter-venture-global-files-for-ipo
LNG shipping,gcaptain.com,Bloomberg,Shipyard Squeeze: Shipping’s $188B Ordering Spree is Overloading Global Capacity,The biggest vessel-ordering program since the eve of the global financial crisis is putting a squeeze on the shipbuilding industry’s capacity to construct new vessels.,"By Alex Longley and Heejin Kim Bloomberg) —
The biggest vessel-ordering program since the eve of the global financial crisis is putting a squeeze on the shipbuilding industrys capacity to construct … [+4518 chars]",2024-12-19T17:50:46Z,https://gcaptain.com/shipyard-squeeze-shippings-188b-ordering-spree-is-overloading-global-capacity/
LNG shipping,gcaptain.com,Mike Schuler,"Trump Demands Panama Canal Reform, Threatens Action Over “Exorbitant” Tolls","President-elect Donald Trump has taken aim at Panama’s management of the Panama Canal, threatening potential action over what he calls “exorbitant” tolls and unfair treatment of U.S. interests. “The fees...","President-elect Donald Trump has taken aim at Panama’s management of the Panama Canal, threatening potential action over what he calls “exorbitant” tolls and unfair treatment of U.S. interests.
“The… [+4258 chars]",2024-12-22T15:18:27Z,https://gcaptain.com/trump-demands-panama-canal-reform-threatens-action-over-exorbitant-tolls/
LNG shipping,The Times of India,Reuters,"India gears up for a potential trade deal as Trump targets China, say government sources","India prepares to offer tariff cuts on US goods like pork, medical devices, and motorcycles, seeking a broader trade deal with the incoming Trump administration.  To address trade imbalances, India proposes increased purchases of US LNG and defense equipment.…","India is preparing to offer tariffs cuts on some farm and other goods mainly imported from the U.S., aiming to clinch a broader trade and investment deal once president-elect Donald Trump takes charg… [+4379 chars]",2024-12-19T12:08:30Z,https://economictimes.indiatimes.com/news/economy/foreign-trade/india-gears-up-for-a-potential-trade-deal-as-trump-targets-china-say-government-sources/articleshow/116474355.cms
LNG shipping,Investing.com,Investing.com,BW LPG Limited “ Ex Dividend US$ 0.42 on the Oslo Stock Exchange Today,BW LPG Limited “ Ex Dividend US$ 0.42 on the Oslo Stock Exchange Today,"SINGAPORE--(BUSINESS WIRE)--With reference to the press release dated 2 December 2024 by BW LPG Limited (BW LPG or the Company, OSE ticker code: BWLPG.OL, NYSE ticker code BWLP) on key information re… [+1507 chars]",2024-12-11T06:24:04Z,https://www.investing.com/news/press-releases/bw-lpg-limited--ex-dividend-us-042-on-the-oslo-stock-exchange-today-93CH-3765325
LNG shipping,[Removed],,[Removed],[Removed],[Removed],2024-12-18T15:19:34Z,https://removed.com
LNG shipping,Newsweek,Gordon G. Chang,China Targets Morocco to Control the Mediterranean—And Global Trade | Opinion,"China uses ports to tie regions to itself, and now America can do the same thing in Dakhla.","On November 21, Xi Jinpingmade a ""technical stopover"" in Casablanca on his way back to China from his triumphant tour of South America. China's leader got the red carpet treatment on arrival, greeted… [+6398 chars]",2024-12-10T15:58:01Z,https://www.newsweek.com/china-targets-morocco-control-mediterranean-global-trade-opinion-1998584
LNG shipping,GlobeNewswire,Capital Clean Energy Carriers Corp.,UPDATE -- Deep Dive into Capital Clean Carriers Energy Corp. Webinar,"1x1 Discussion - CCEC, CEO & Deputy Head of Research, Fearnley Securities 1x1 Discussion - CCEC, CEO & Deputy Head of Research, Fearnley Securities","NEW YORK, Dec. 11, 2024 (GLOBE NEWSWIRE) -- In the context of Capital Links Deep Dive Series, Mr. Jerry Kalogiratos, CEO of Capital Clean Energy Carriers Corp. (NASDAQ: CCEC), joined Mr. Nils Thomess… [+3577 chars]",2024-12-11T22:42:00Z,https://www.globenewswire.com/news-release/2024/12/11/2995793/20327/en/UPDATE-Deep-Dive-into-Capital-Clean-Carriers-Energy-Corp-Webinar.html
LNG shipping,GlobeNewswire,Capital Clean Energy Carriers Corp.,UPDATE -- Deep Dive into Capital Clean Energy Carriers Corp. Webinar,"1x1 Discussion - CCEC, CEO & Deputy Head of Research, Fearnley Securities 1x1 Discussion - CCEC, CEO & Deputy Head of Research, Fearnley Securities","NEW YORK, Dec. 11, 2024 (GLOBE NEWSWIRE) -- In the context of Capital Links Deep Dive Series, Mr. Jerry Kalogiratos, CEO of Capital Clean Energy Carriers Corp. (NASDAQ: CCEC), joined Mr. Nils Thomess… [+3577 chars]",2024-12-11T22:42:00Z,https://www.globenewswire.com/news-release/2024/12/11/2995793/20327/en/UPDATE-Deep-Dive-into-Capital-Clean-Energy-Carriers-Corp-Webinar.html
LNG shipping,GlobeNewswire,Capital Link,Deep Dive into Capital Clean Carriers Energy Corp. Webinar,"1x1 Discussion - CCEC, CEO & Deputy Head of Research, Fearnley Securities 1x1 Discussion - CCEC, CEO & Deputy Head of Research, Fearnley Securities","NEW YORK, Dec. 11, 2024 (GLOBE NEWSWIRE) -- In the context of Capital Links Deep Dive Series, Mr. Jerry Kalogiratos, CEO of Capital Clean Energy Carriers Corp. (NASDAQ: CCEC), joined Mr. Nils Thomess… [+3577 chars]",2024-12-11T21:05:00Z,https://www.globenewswire.com/news-release/2024/12/11/2995747/20326/en/Deep-Dive-into-Capital-Clean-Carriers-Energy-Corp-Webinar.html
LNG shipping,Investing.com,Investing.com,UPDATE -- Deep  Dive  into Capital Clean Carriers Energy Corp. Webinar,UPDATE -- Deep  Dive  into Capital Clean Carriers Energy Corp. Webinar,"NEW YORK, Dec. 11, 2024 (GLOBE NEWSWIRE) -- In the context of Capital Link's Deep Dive Series, Mr. Jerry Kalogiratos, CEO of Capital Clean Energy Carriers Corp. (NASDAQ: CCEC), joined Mr. Nils Thomes… [+3628 chars]",2024-12-11T22:44:03Z,https://www.investing.com/news/press-releases/update--deep-dive-into-capital-clean-carriers-energy-corp-webinar-93CH-3767680
LNG shipping,GlobeNewswire,Research and Markets,Shipbuilding Strategic Industry Report 2024 - Focus on Reducing CO2 Emissions Drives Adoption of Eco-Friendly Vessels,"Coverage of major players in the Global Shipbuilding Market such as BAE Systems, China Merchants Industry, China Shipbuilding Industry, China State Shipbuilding, COSCO Shipping Heavy Industry and more. Coverage of major players in the Global Shipbuilding Mark…","Dublin, Dec. 06, 2024 (GLOBE NEWSWIRE) -- The ""Shipbuilding - Global Strategic Business Report"" has been added to ResearchAndMarkets.com's offering.
The global market for shipbuilding was estimated … [+9007 chars]",2024-12-06T09:08:00Z,https://www.globenewswire.com/news-release/2024/12/06/2992870/28124/en/Shipbuilding-Strategic-Industry-Report-2024-Focus-on-Reducing-CO2-Emissions-Drives-Adoption-of-Eco-Friendly-Vessels.html
LNG shipping,Investing.com,Investing.com,BW LPG Limited - BW LPG Takes Delivery of Vessel BW Breeze From Avance Gas,BW LPG Limited - BW LPG Takes Delivery of Vessel BW Breeze From Avance Gas,SINGAPORE--(BUSINESS WIRE)--With reference to the stock exchange announcement on 15 August 2024 for the acquisition of 12 modern Very Large Gas Carriers (VLGCs) from Avance Gas Holdings Ltd (Avance G… [+2041 chars],2024-12-16T04:00:10Z,https://www.investing.com/news/press-releases/bw-lpg-limited--bw-lpg-takes-delivery-of-vessel-bw-breeze-from-avance-gas-93CH-3773369
LNG shipping,Investing.com,Investing.com,BW LPG Limited “ Key Information Relating to the Cash Dividend for Q3 2024,BW LPG Limited “ Key Information Relating to the Cash Dividend for Q3 2024,"SINGAPORE--(BUSINESS WIRE)--BW LPG Limited (BW LPG"" or the ""Company"", OSE ticker code: ""BWLPG.OL"", NYSE ticker code ""BWLP"") provides the following key information relating to the Company's cash divid… [+2157 chars]",2024-12-02T08:28:04Z,https://www.investing.com/news/press-releases/bw-lpg-limited--key-information-relating-to-the-cash-dividend-for-q3-2024-93CH-3748188
LNG shipping,Investing.com,Investing.com,BW LPG Limited - BW LPG Takes Delivery of Vessel BW Pampero from Avance Gas,BW LPG Limited - BW LPG Takes Delivery of Vessel BW Pampero from Avance Gas,SINGAPORE--(BUSINESS WIRE)--With reference to the stock exchange announcement on 15 August 2024 for the acquisition of 12 modern Very Large Gas Carriers (VLGCs) from Avance Gas Holdings Ltd (Avance G… [+2085 chars],2024-12-07T09:48:03Z,https://www.investing.com/news/press-releases/bw-lpg-limited--bw-lpg-takes-delivery-of-vessel-bw-pampero-from-avance-gas-93CH-3760239
LNG shipping,Investing.com,Investing.com,BW LPG Limited - BW LPG Takes Delivery of Vessel BW Rigel From Avance Gas,BW LPG Limited - BW LPG Takes Delivery of Vessel BW Rigel From Avance Gas,SINGAPORE--(BUSINESS WIRE)--With reference to the stock exchange announcement on 15 August 2024 for the acquisition of 12 modern Very Large Gas Carriers (VLGCs) from Avance Gas Holdings Ltd (Avance G… [+2051 chars],2024-12-06T10:32:04Z,https://www.investing.com/news/press-releases/bw-lpg-limited--bw-lpg-takes-delivery-of-vessel-bw-rigel-from-avance-gas-93CH-3758655
LNG shipping,Investing.com,Investing.com,BW LPG Limited - BW LPG Takes Delivery of Vessels BW Mistral and BW Polaris From Avance Gas,BW LPG Limited - BW LPG Takes Delivery of Vessels BW Mistral and BW Polaris From Avance Gas,SINGAPORE--(BUSINESS WIRE)--With reference to the stock exchange announcement on 15 August 2024 for the acquisition of 12 modern Very Large Gas Carriers (VLGCs) from Avance Gas Holdings Ltd (Avance G… [+2070 chars],2024-12-10T07:36:04Z,https://www.investing.com/news/press-releases/bw-lpg-limited--bw-lpg-takes-delivery-of-vessels-bw-mistral-and-bw-polaris-from-avance-gas-93CH-3762930
LNG shipping,Energycentral.com,[Energy Central] German Toro Ghio,South American and Caribbean Natural Gas: A Strategic Asset in Uncertain Times….,"“Cosmic forces have aligned to awaken the dormant natural gas reserves in Latin America's heart, preparing them for their moment to shine… “The natural gas surge in the Dominican Republic, led by AES Dominicana, is a game-changer that is creating new opportun…","The natural gas surge in the Dominican Republic, led by AES Dominicana, is a game-changer that is creating new opportunities.
Cheers to Our Success! Merco 2024 has recognized AES Dominicana as the f… [+24266 chars]",2024-12-12T17:16:12Z,https://energycentral.com/c/iu/south-american-and-caribbean-natural-gas-strategic-asset-uncertain-times%E2%80%A6
LNG shipping,OilPrice.com,Editorial Dept,A Shipbuilding Boom in 2024,"Wary of Worsening Export Economics, Chinese Refiners Flushes Out Stocks - Chinese companies maximized their exports of oil products in November, ahead of an increase in government levies after Beijing reduced the country’s VAT rebate for product exports from …","Russian crude oil exports have…
Concerns over global economic growth…
Oil prices are under pressure…
By Editorial Dept - Dec 20, 2024, 8:30 AM CST
Wary of Worsening Export Economics, Chinese Refi… [+8404 chars]",2024-12-20T14:30:00Z,https://oilprice.com/Energy/Energy-General/A-Shipbuilding-Boom-in-2024.html
LNG shipping,The Times of India,PTI,GAIL signs long-term charter contract with K-Line for LNG ship,"GAIL has signed a long-term charter agreement with Kawasaki Kisen Kaisha for a new LNG ship to be operational in 2027. The ship will be built by Samsung Heavy Industries and will have a tank capacity of 1,74,000 cubic metres. This new vessel will join GAIL's …","State gas utility GAIL (India) Ltd on Friday signed an agreement with Kawasaki Kisen Kaisha, Ltd for long-term charter hire of a newly built LNG ship. The pact was signed through the ship-owning comp… [+1733 chars]",2024-11-29T11:56:04Z,https://economictimes.indiatimes.com/industry/energy/oil-gas/gail-signs-long-term-charter-contract-with-k-line-for-lng-ship/articleshow/115808579.cms
LNG shipping,Substack.com,Bill Mckibben,What the Biden Admin Can Still Do to Defuse the LNG Bomb Before Trump Grabs the Trigger,"When the environmental history of the Biden administration is written, the Inflation Reduction Act will have pride of place—for all its compromises and flaws, it finally set serious federal money flowing toward the task of an energy transition, and defending …","When the environmental history of the Biden administration is written, the Inflation Reduction Act will have pride of placefor all its compromises and flaws, it finally set serious federal money flow… [+8263 chars]",2024-12-04T16:27:24Z,https://billmckibben.substack.com/p/a-win-of-sorts-on-something-really
LNG shipping,Investing.com,Investing.com,BW LPG Limited - Financial Results for Q3 2024,BW LPG Limited - Financial Results for Q3 2024,"SINGAPORE--(BUSINESS WIRE)--Highlights and Subsequent Events
<ul><li>Another good quarter for shipping with TCE income - Shipping Q3 2024 concluded at US$46,800 per available day and US$46,500 per c… [+9178 chars]",2024-12-02T07:44:03Z,https://www.investing.com/news/press-releases/bw-lpg-limited--financial-results-for-q3-2024-93CH-3748141
LNG shipping,Financial Post,Bloomberg News,Shipping Industry’s $188 Billion Binge Cuts Space to Make New Vessels,The biggest vessel-ordering program since the eve of the global financial crisis is putting a squeeze on the shipbuilding industry’s capacity to construct new vessels.,"The biggest vessel-ordering program since the eve of the global financial crisis is putting a squeeze on the shipbuilding industrys capacity to construct new vessels.
Author of the article:
abjh1[l… [+7468 chars]",2024-12-19T11:54:18Z,https://financialpost.com/pmn/business-pmn/shipping-industrys-188-billion-binge-cuts-space-to-make-new-vessels
LNG shipping,gcaptain.com,Sponsored,Future-Proof Shipbuilding: Fuel-Agnostic Efficiency Solutions for IMO and FuelEU Compliance,The maritime industry is undergoing a profound transformation as it confronts the dual challenge of reducing greenhouse gas (GHG) emissions and maintaining operational efficiency. The International Maritime Organization’s (IMO) 2050...,The maritime industry is undergoing a profound transformation as it confronts the dual challenge of reducing greenhouse gas (GHG) emissions and maintaining operational efficiency. The International M… [+5431 chars],2024-12-02T20:09:40Z,https://gcaptain.com/future-proof-shipbuilding-fuel-agnostic-efficiency-solutions-for-imo-and-fueleu-compliance/
LNG shipping,OilPrice.com,Alex Kimani,Why the Latest Baltic Sea Cable Evidence Has Wider Implications,Naval and coast guard vessels from several European countries have forced a Chinese commercial ship to anchor in the Baltic Sea after suspecting it deliberately sabotaged undersea internet infrastructure. International investigators believe the crew aboard Yi…,"Over the weekend, Russia launched…
Ukraine and Russia escalated attacks…
Russia has withdrawn without explanation…
By Alex Kimani - Nov 28, 2024, 7:00 PM CSTNaval and coast guard vessels from seve… [+5920 chars]",2024-11-29T01:00:00Z,https://oilprice.com/Geopolitics/Europe/Why-the-Latest-Baltic-Sea-Cable-Evidence-Has-Wider-Implications.html
LNG shipping,ETF Daily News,MarketBeat News,Contrasting TotalEnergies (NYSE:TTE) and Matador Resources (NYSE:MTDR),"Matador Resources (NYSE:MTDR – Get Free Report) and TotalEnergies (NYSE:TTE – Get Free Report) are both oils/energy companies, but which is the better stock? We will contrast the two companies based on the strength of their institutional ownership, earnings, …","Matador Resources (NYSE:MTDR – Get Free Report) and TotalEnergies (NYSE:TTE – Get Free Report) are both oils/energy companies, but which is the better stock? We will contrast the two companies based … [+6117 chars]",2024-11-26T06:38:58Z,https://www.etfdailynews.com/2024/11/26/contrasting-totalenergies-nysette-and-matador-resources-nysemtdr/
LNG shipping,ETF Daily News,MarketBeat News,Analyzing TotalEnergies (NYSE:TTE) and The American Energy Group (OTCMKTS:AEGG),"TotalEnergies (NYSE:TTE – Get Free Report) and The American Energy Group (OTCMKTS:AEGG – Get Free Report) are both oils/energy companies, but which is the better business? We will compare the two businesses based on the strength of their valuation, risk, anal…","TotalEnergies (NYSE:TTE – Get Free Report) and The American Energy Group (OTCMKTS:AEGG – Get Free Report) are both oils/energy companies, but which is the better business? We will compare the two bus… [+4859 chars]",2024-12-17T07:56:56Z,https://www.etfdailynews.com/2024/12/17/analyzing-totalenergies-nysette-and-the-american-energy-group-otcmktsaegg/
LNG shipping,OilPrice.com,Alex Kimani,DOE Warns Against LNG Export Frenzy,"Back in February, leading energy information company, Energy Intelligence, reported that interest in long-term LNG projects remains robust despite the Biden administration pausing new licenses for LNG export projects still in the planning pipeline. Back then,…","The U.S. LNG industry is…
Recent meetings with Qatar, along…
The looming global gas crisis…
By Alex Kimani - Dec 18, 2024, 6:00 PM CSTBack in February, leading energy information company, Energy I… [+5069 chars]",2024-12-19T00:00:00Z,https://oilprice.com/Energy/Natural-Gas/DOE-Warns-Against-LNG-Export-Frenzy.html
