topic,source,author,title,description,content,published_at,url
trade wars,Forbes,"Ken Roberts, Contributor, 
 Ken Roberts, Contributor
 https://www.forbes.com/sites/kenroberts/","U.S. Imports: Some Hit Hard By Tariffs, Wars, New Tech, No New Tech","U.S. imports will nevertheless top $3 trillion again this year, either breaking the 2022 record or narrowly missing it.","The value of U.S. imports is flirting with a new record in 2024 but these six imports are ... [+] underperforming.
WorldCity
Despite wars in Europe and the Middle East, tariffs, continued adoption … [+11231 chars]",2024-12-14T10:00:00Z,https://www.forbes.com/sites/kenroberts/2024/12/14/us-imports-some-hit-hard-by-tariffs-wars-new-tech-no-new-tech/
trade wars,Solarboi.com,,Sol-Ark manufacturer reportedly disables all Deye inverters in the US,"Seemingly, at the drop of a hat the morning of Friday, Nov 15th, Deye-branded inverters across the US were intentionally bricked.","Updated on Mon, Nov 18th, 6AM to add corroboration and Sol-Ark’s response, and 4PM to add an additional response from Sol-Ark, including changes in wording from “OEM” to “contract manufacturer”, a di… [+6892 chars]",2024-11-30T02:51:57Z,https://solarboi.com/2024/11/17/sol-ark-oem-disables-all-deye-inverters-in-the-us/
trade wars,Quartz India,Britney Nguyen,Nvidia's stock is down over 10% as Trump talks up tariffs,"While Nvidia’s (NVDA) shares have tripled in value so far this year, its shares dropped more than 10% in the week after it reported fiscal third-quarter earnings.Read more...","In This Story
While Nvidias (NVDA-2.04%
) shares have tripled in value so far this year, its shares dropped more than 10% in the week after it reported fiscal third-quarter earnings.
The chipmaker… [+1960 chars]",2024-11-27T19:00:00Z,https://qz.com/nvidia-stock-down-third-quarter-trump-tariffs-china-1851709443
trade wars,Forbes,"Caroline Reid, Senior Contributor, 
 Caroline Reid, Senior Contributor
 https://www.forbes.com/sites/carolinereid/",Disney's Over Spending On ‘The Acolyte’ Pushes Star Wars Costs To $2.9 Billion,Disney's over spending on The Acolyte has pushed the total cost of its Star Wars movies and shows made in the U.K. to $2.9 billion according to its latest filings.,"The budget of 'The Acolyte' has pushed Disney's spending on Star Wars productions to $2.9bn ©2024 ... [+] Lucasfilm Ltd. &amp; TM. All Rights Reserved.
Lucasfilm Ltd.
Disney's over spending on Star… [+8324 chars]",2024-12-04T23:59:54Z,https://www.forbes.com/sites/carolinereid/2024/12/04/disneys-over-spending-on-the-acolyte-pushes-star-wars-costs-to-29-billion/
trade wars,RT,RT,‘No winners’: China’s Xi warns US against a trade war,Chinese President Xi Jinping has warned that there would be no winners in a trade war with the US Read Full Article at RT.com,"Chinese President Xi Jinping has warned that neither side will emerge victorious in the event of a trade war with the US.
The Chinese leader spoke on Tuesday to the heads of major international econ… [+1873 chars]",2024-12-12T06:06:07Z,https://www.rt.com/news/609225-no-winners-trade-war-xi/
trade wars,Thefp.com,Jay Solomon,Is World War III Already Here?,"Is World War III Already Here?

 
 
 
 (Third column, 11th story, link)

 

 

 
 Related stories:In Syria, a long-dormant civil war reignites...
PAPER: If Assad falls, Putin and the mullahs could be next...","An Israeli air strike in Beirut on November 22, 2024. (via Getty Images)
The Axis of Upheaval is on the marchand the U.S. must figure out how to respond.
If it feels like the world is on fire right… [+10145 chars]",2024-12-05T22:37:37Z,https://www.thefp.com/p/world-war-iii-syria-israel-south-korea-ukrains
trade wars,Yahoo Entertainment,Peter CATTERALL,China's Xi warns 'no winners' in trade war with US,"Chinese President Xi Jinping warned Tuesday that there would be ""no winners"" in a trade war with the United States and vowed the country would hit its growth...","Chinese President Xi Jinping warned Tuesday that there would be ""no winners"" in a trade war with the United States and vowed the country would hit its growth goals for the year.
Former US president … [+3681 chars]",2024-12-10T06:46:08Z,https://www.yahoo.com/news/chinas-xi-warns-no-winners-064608206.html
trade wars,Screen Rant,David Miller,"Everything You Need To Know About Crimson Jack, Star Wars' First Pirate Master & Han Solo's Rival","One of the first original Star Wars villains to ever appear in Star Wars non-movie materials is Crimson Jack, a pirate leader and rival to Han Solo.",The first major pirate in the Star Wars franchise Crimson Jack debuted shortly after A New Hope and quickly became a major threat to Han Solo and his newfound Rebel allies. Crimson Jack debuted in Ma… [+4995 chars],2024-11-28T02:10:19Z,https://screenrant.com/star-wars-crimson-jack-pirate-explained/
trade wars,[Removed],,[Removed],[Removed],[Removed],2024-11-25T08:47:09Z,https://removed.com
trade wars,Acoup.blog,Bret Devereaux,Collections: On Bread and Circuses,"Coming off of some of the discussion of Gladiator II (I, II), this week I want to discuss the place of ‘bread and circuses’ in the narrative of Roman decadence and decline. This is one …","Coming off of some of the discussion of Gladiator II (I, II), this week I want to discuss the place of ‘bread and circuses’ in the narrative of Roman decadence and decline. This is one of those phras… [+37002 chars]",2024-12-20T15:30:40Z,https://acoup.blog/2024/12/20/collections-on-bread-and-circuses/
trade wars,Bleeding Cool News,Tyler Roberts,New Star Wars Clone Trooper & Super Battle Droid 2-Pack Revealed,"War rages on as the Star Wars Gift the Galaxy campaign is coming to an end with its final set of reveals. Two new sets were revealed, including one that will take collectors back to the Battle of Geonosis. Hasbro Pulse has unveiled an exclusive Star Wars: The…","Posted in: Collectibles, Hasbro | Tagged: hasbro, star wars
Step into a galaxy far, far away with Hasbros final Star Wars: Gift the Galaxy figures including a new Clone Trooper bundle 
<ul><li>Unle… [+2390 chars]",2024-12-18T14:52:10Z,https://bleedingcool.com/collectibles/new-star-wars-clone-trooper-super-battle-droid-2-pack-revealed/
trade wars,Humblebundle.com,Robert Falchi,The Hottest (and Coldest) Star Wars Gaming Releases of All Time,"The power of the Force is strong with this bundle of games. Our Disney Classics Black Friday Humble Bundle Sale showcases some of the best STAR WARS games across a wide range of console generations. To celebrate, we’ve assembled a library of STAR WARS classic…",The power of the Force is strong with this bundle of games. Our Disney Classics Black Friday Humble Bundle Sale showcases some of the best STAR WARS games across a wide range of console generations. … [+6055 chars],2024-11-29T19:32:13Z,https://blog.humblebundle.com/best-and-worst-star-wars-video-games/
trade wars,Foreign Policy,Keith Johnson,Trump’s Trade Wars Are Already Starting,"Tariff threats against Mexico, Canada, and China are a preview of what's to come.",U.S. President-elect Donald Trump has already waded into his future trade wars before taking office. His proposal of a steep import tax on all products from the countrys top trade partners gives a pr… [+6740 chars],2024-11-26T22:08:03Z,https://foreignpolicy.com/2024/11/26/trump-tariffs-canada-mexico-china-trade/
trade wars,MSNBC,Chris Hayes,Trump says his tariffs on Mexico will lower overdose deaths. Biden’s policies already have.,"The U.S. is experiencing a drop in drug fatalities thanks, in part, to Biden's policies. Chris Hayes explains how Trump's trade wars could threaten that progress.","This is an adapted excerpt from the Nov. 26 episode of ""All In with Chris Hayes.""
Even allies of President-elect Donald Trump are admitting that his plan for tariffs will drive up the cost of pretty… [+4826 chars]",2024-12-02T11:00:00Z,https://www.msnbc.com/top-stories/latest/trump-tariffs-overdose-opioid-epidemic-rcna182059
trade wars,Nakedcapitalism.com,Yves Smith,Monetary Policy in Response to Tariff Shocks,"If the Trump tariff scheme weakens the economy enough, the Fed would do better to ease rather than tighten even if inflation increases.","Yves here. This post discusses the widespread assumption that if Trump moves forward with his plan to impose across-the-board tariffs on America’s three biggest trade partners, that will be inflation… [+13865 chars]",2024-11-27T06:19:14Z,https://www.nakedcapitalism.com/2024/11/monetary-policy-in-response-to-tariff-shocks.html
trade wars,Foreign Policy,Keith Johnson,Trump’s Trade Threats May Have a Silver Lining for Europe,"Brussels may not have as many trade ripostes as China, but it could turn trade wars into economic liberation.",Among the many countries targeted by U.S. President-elect Donald Trumps tariff threatsa net that he recently widened to include all the BRICS countries if they so much as think of abandoning the doll… [+8610 chars],2024-12-04T18:42:49Z,https://foreignpolicy.com/2024/12/04/trump-tariffs-trade-europe/
trade wars,TVLine,Matt Webb Mitovich,"Skeleton Crew’s Jude Law on Episode 3 Cliffhanger, Jod’s Secrets: ‘The Adventure Is Literally Just Beginning’","The following contains spoilers from Episode 3 of Star Wars: Skeleton Crew, now streaming on Disney+. Episode 3 of Disney+’s Star Wars: Skeleton Crew saw the mysterious Jod Na Nawood (played by Jude Law) lead the way out of the brig, as he, Wim, Fern, KB and …","The following contains spoilers from Episode 3 of Star Wars: Skeleton Crew, now streaming on Disney+.
Episode 3 of Disney+’s Star Wars: Skeleton Crew saw the mysterious Jod Na Nawood (played by Jude… [+3790 chars]",2024-12-11T02:40:00Z,https://tvline.com/recaps/skeleton-crew-episode-3-ending-explained-jod-crimson-jack-at-attin-1235386795/
trade wars,Project Syndicate,PS Commentators,Will Trumponomics Bring Boom or Bust in 2025?,"Many Americans voted for Donald Trump last month in the hopes that the dealmaker-president would usher in a period of economic renewal that would lift businesses and workers alike. But the merits of Trump’s likely policies remain hotly debated, and his capric…","J. Bradford DeLong
The Oscar-winning screenwriter William Goldman famously summed up Hollywood in three words: Nobody knows anything. The same can be said about the incoming Trumps administration.
… [+9789 chars]",2024-12-19T13:25:56Z,https://www.project-syndicate.org/onpoint/will-trumponomics-bring-boom-or-bust-in-2025
trade wars,RT,RT,African state thanks Russia for help in lifting diamond export ban,CAR has thanked Russia’s role in lifting diamond trade restrictions Read Full Article at RT.com,Central African Republic (CAR) President Faustin-Archange Touadera has expressed his gratitude to Russian President Vladimir Putin for Russia’s pivotal role in helping lift restrictions on the countr… [+1744 chars],2024-11-25T14:48:04Z,https://www.rt.com/africa/608177-car-russia-help-lifting-diamond-embargo/
trade wars,Android Police,Chris Thomas,I'm amazed Samsung's XR glasses shifted to such a different focus than originally implied,"Is Samsung spooked, or just playing it safe? Its XR glasses ditch the display, Snapdragon XR2, early 2025 launch, and 90% of the first production run","Key Takeaways
<ul><li> Samsung's XR glasses project has apparently pivoted since VR rumors emerged, with a newly leaked short production run, no display, and a lower-tier SoC, in addition to a delay… [+8589 chars]",2024-12-09T22:29:41Z,https://www.androidpolice.com/samsung-xr-glasses-galaxy-unpacked-prototype-release-q2-50k-units/
trade wars,Yahoo Entertainment,AFP,"Brussels, not Paris, will decide EU-Mercosur trade deal: Lula","France does not get to decide whether a free trade deal between the EU and South America's Mercosur bloc goes ahead -- only Brussels does, Brazilian...","Yahoo is using AI to generate takeaways from this article. This means the info may not always match what's in the article. Reporting mistakes helps us improve the experience.Generate Key Takeaways
F… [+2502 chars]",2024-11-27T18:01:01Z,https://www.yahoo.com/news/brussels-not-paris-decide-eu-180101729.html
trade wars,The American Conservative,Brandan Buck,Invading Mexico Will Not Solve the Cartel Problem,"Proposals for the use of military force in our southern neighbor’s territory neglect the lessons of the wars on terror and drugs.
The post Invading Mexico Will Not Solve the Cartel Problem appeared first on The American Conservative.","In an era of seemingly never-ending foreign and domestic crises, the incoming Trump administration has signaled openness to an idea to tackle an issue that straddles both spheres: the use of military… [+10482 chars]",2024-12-17T05:03:00Z,https://www.theamericanconservative.com/invading-mexico-will-not-solve-the-cartel-problem/
trade wars,Windows Central,ben.wilson@windowscentral.com (Ben Wilson),"Thrustmaster T.Flight Hotas One Microsoft Flight Simulator Edition review: Without a doubt, the best budget flight stick for beginners fascinated by MSFS 2024",An unashamed promotional re-release of a stellar yet affordable pick for flight simulation beginners is still the best value HOTAS combo.,"Microsoft Flight Simulator has become a mainstream attraction with its recent releases, starting in 2020 with a spectacular virtual recreation of our entire planet and following up with a successor i… [+11836 chars]",2024-12-16T18:00:43Z,https://www.windowscentral.com/gaming/thrustmaster-t-flight-hotas-one-microsoft-flight-simulator-edition-review
trade wars,Reason,Eric Boehm,Peter Navarro Should Not Have Power Over U.S. Trade Policy—or Anything,"Shortly after then-President Donald Trump launched his ""good and easy to win"" trade wars in 2017, Peter Navarro sat down with CNN's Jake Tapper to defend","Shortly after then-President Donald Trump launched his ""good and easy to win"" trade wars in 2017, Peter Navarro sat down with CNN's Jake Tapper to defend the use of tariffs. Asked whether Americans w… [+4331 chars]",2024-12-04T19:42:25Z,https://reason.com/2024/12/04/peter-navarro-should-not-have-power-over-u-s-trade-policy-or-anything/
trade wars,International Business Times,Peter CATTERALL,China's Xi Warns 'No Winners' In Trade War With US,"Chinese President Xi Jinping warned Tuesday that there would be ""no winners"" in a trade war with the United States and vowed the country would hit its growth goals for the year.","Chinese President Xi Jinping warned Tuesday that there would be ""no winners"" in a trade war with the United States and vowed the country would hit its growth goals for the year.
Former US president … [+3647 chars]",2024-12-10T06:51:17Z,https://www.ibtimes.com/chinas-xi-warns-no-winners-trade-war-us-3754750
trade wars,Project Syndicate,Yanis Varoufakis,"The West Is Not Dying, but It Is Working on It","Western power is as strong as ever. What has changed is that the combination of socialism for financiers, collapsing prospects for the bottom 50%, and the surrender of our minds to Big Tech has given rise to overweening Western elites with little use for the …","Western power is as strong as ever. What has changed is that the combination of socialism for financiers, collapsing prospects for the bottom 50%, and the surrender of our minds to Big Tech has given… [+6556 chars]",2024-12-19T14:08:54Z,https://www.project-syndicate.org/commentary/west-has-abandoned-western-values-by-yanis-varoufakis-2024-12
trade wars,Crooksandliars.com,Ed Scarce,Trump Refers To 'Governor Justin Trudeau' And 'The Great State Of Canada',"Justin Trudeau is not popular in Canada, to put it mildly, with just a 28% approval rating. And if an election were called, his Liberal Party would get crushed by the Conservatives. But if there's one thing a country as large and as diverse as Canada agrees o…","Justin Trudeau is not popular in Canada, to put it mildly, with just a 28% approval rating. And if an election were called, his Liberal Party would get crushed by the Conservatives. But if there's on… [+1770 chars]",2024-12-10T22:43:56Z,https://crooksandliars.com/2024/12/trump-refers-governor-justin-trudeau-and
trade wars,Dailyreckoning.com,Adam Sharp,Trade Wars Accelerate,"This post Trade Wars Accelerate appeared first on Daily Reckoning.
The trade war with China is heating up and the implications for the future of America are massive.
The post Trade Wars Accelerate appeared first on Daily Reckoning.","During Donald Trumps first term, U.S. tariffs on China increased from 3% in 2016 to 19% by the end of 2020.
As a result, Chinas share of the U.S. trade deficit dropped from 47% to 26%. However, its … [+4608 chars]",2024-12-16T23:00:09Z,https://dailyreckoning.com/trade-wars-accelerate/
trade wars,Forbes,"John Werner, Contributor, 
 John Werner, Contributor
 https://www.forbes.com/sites/johnwerner/",The Push And Pull Of Sino-American Chip Politics,"There’s a lot going on behind the scenes in the local chip market, and a lot of it is focused on front-runner Nvidia.",Amer. &amp; Chinese flags table decorations during US/China ceremony renewing 1989 MOA Memo of Agreement ... [+] re Intl. Trade in Commercial Launch Services. (Photo by Forrest Anderson/Getty Images)… [+5396 chars],2024-12-10T17:49:34Z,https://www.forbes.com/sites/johnwerner/2024/12/10/the-push-and-pull-of-sino-american-chip-politics/
trade wars,Hurriyet Daily News,hurriyetdailynews.com,"World trade outlook uncertain on US tariff threats, says UN","World trade faces an uncertain outlook in 2025 because of the threat of trade wars, after global commerce hit a new peak this year, the U.N. has said.","NEW YORK
World trade faces an uncertain outlook in 2025 because of the threat of trade wars, after global commerce hit a new peak this year, the U.N. has said.
The U.N. trade and development agency… [+1397 chars]",2024-12-06T05:42:04Z,https://www.hurriyetdailynews.com/world-trade-outlook-uncertain-on-us-tariff-threats-says-un-203340
trade wars,[Removed],,[Removed],[Removed],[Removed],2024-11-26T18:11:29Z,https://removed.com
trade wars,Japan Today,,China's Xi warns 'no winners' in trade war with U.S.,Chinese President Xi Jinping warned Tuesday that there would be &quot;no winners&quot; in a trade war with the United States and vowed the country would hit its growth goals for the year. Donald Trump -- who returns to the White House next month -- unleashed …,"Chinese President Xi Jinping warned Tuesday that there would be ""no winners"" in a trade war with the United States and vowed the country would hit its growth goals for the year.
Donald Trump -- who … [+3644 chars]",2024-12-10T21:44:36Z,https://japantoday.com/category/business/china%27s-xi-warns-%27no-winners%27-in-trade-war-with-us
trade wars,Americanthinker.com,,What Trump Can Do with Clausewitz,"After the Napoleonic Wars, Prussian general Carl von Clausewitz wrote his seminal treatise, On War.  Published in 1832, On War was not immediately recognized as the authoritative work it is today.  Rather, in the post-Napoleonic p...","After the Napoleonic Wars, Prussian general Carl von Clausewitz wrote his seminal treatise, On War.  Published in 1832, On War was not immediately recognized as the authoritative work it is today.  R… [+7087 chars]",2024-12-20T05:00:00Z,https://www.americanthinker.com/articles/2024/12/what_trump_can_do_with_clausewitz.html
trade wars,IGN,Eric Song,"The Target Black Friday Sale Starts Now: The Best Deals on Pokemon TCG, Apple, Board Games, and More",One of the biggest and most anticipated Black Friday sales.,"The Target Black Friday Sale has officially commenced! Target is one of the most popular retailers for Black Friday, and one thing I've learned over the years of finding deals is that it knows how to… [+15217 chars]",2024-11-28T12:35:00Z,https://www.ign.com/articles/best-target-black-friday-sales
trade wars,IGN,Eric Song,"The Best Black Friday Deals Start Now: Lowest Prices on PS5, Switch, Apple, LEGO, and More","We made it to the biggest sale of the year. Dive into the best Black Friday deals of 2024, across games, consoles, tech, gadgets, toys and so much more.","The Black Friday sales have now officially commenced! I've worked through numerous Black Fridays over the years, and my experience has always been the same: Black Friday actually starts on Thanksgivi… [+13878 chars]",2024-11-28T09:20:00Z,https://www.ign.com/articles/best-black-friday-2024-deals
trade wars,CNA,,China's Xi says trade war with US will have 'no winners',"BEIJING: Chinese President Xi Jinping warned on Tuesday (Dec 10) that a trade war with the United States would result in ""no winners"", state media said, ahead of next month's inauguration of president-elect Donald Trump. The former US president unleashed a gr…","BEIJING: Chinese President Xi Jinping warned on Tuesday (Dec 10) that a trade war with the United States would result in ""no winners"", state media said, ahead of next month's inauguration of presiden… [+1147 chars]",2024-12-10T06:45:00Z,https://www.channelnewsasia.com/east-asia/chinas-xi-says-trade-war-us-will-have-no-winners-4797646
trade wars,Screen Rant,Chris Miller,Darth Maul’s Personal Mantra Perfectly Explains Why Star Wars Allowed the Sith to Defeat the Jedi,"Emperor Palpatine’s plan was there from the beginning, echoed in the words of his first apprentice. If only the Jedi had taken Maul seriously.","One of Star Wars most compelling and powerful Sith Lords, Darth Maul
 is a persistent menace whose Sith Code perfectly mirrors Palpatine and the Empires rise in power. One of Palpatines earliest app… [+5806 chars]",2024-12-20T04:59:17Z,https://screenrant.com/star-wars-darth-maul-quote-sith-factoid/
trade wars,Crooksandliars.com,Ed Scarce,Ontario Premier Threatens U.S. Over Trump's Tariffs: 'We Will Cut Off Their Energy',"If Ontario carries through on its threats, millions of Americans would be without electricity and major oil pipelines would be shut off.
Trade wars between neighbors are the dumbest wars.
Source: WWNY
ONTARIO, Canada (WWNY) - Canada appears ready to fight bac…","If Ontario carries through on its threats, millions of Americans would be without electricity and major oil pipelines would be shut off.Trade wars between neighbors are the dumbest wars.ONTARIO, Cana… [+1035 chars]",2024-12-14T17:31:56Z,https://crooksandliars.com/2024/12/ontario-premier-threatens-us-over-trumps
trade wars,Al Jazeera English,Simon Speakman Cordall,"Irish support for Palestinians stands firm, despite Israeli anger","Israel may have withdrawn its ambassador, but Irish support for Palestinians is deep-rooted.","Irelands decision to join South Africas International Court of Justice (ICJ) case accusing Israel of committing genocide in Gaza continues to feed a diplomatic storm that, to many observers, has been… [+7261 chars]",2024-12-17T17:14:05Z,https://www.aljazeera.com/news/2024/12/17/irish-support-for-palestinians-stands-firm-despite-israeli-anger
trade wars,EURACTIV,Sofia Sanchez Manzanaro,"Agri-food caught in crossfire of looming trade wars, WTO paralysis","If implemented, Trump's tariff policy could escalate trade tensions and trigger more WTO disputes, which would be difficult to resolve due to the paralysis of the Appellate Body.","If implemented, Trump’s tariff policy could escalate trade tensions and trigger more WTO disputes, which would be difficult to resolve due to the paralysis of the Appellate Body.",2024-11-26T15:19:25Z,https://www.euractiv.com/section/agriculture-food/news/agri-food-caught-in-crossfire-of-looming-trade-wars-wto-paralysis/
trade wars,Nakedcapitalism.com,Yves Smith,"Trump, Tariffs, Exchange Rates, and the Strong Dollar Problem: The Message of Elections in the US and Japan","Trump's win highlights popular anger in the US, Japan, and Europe over the economy despite high stock prices and low unemployment","Yves here. Richard Koo, famed for his creation of the balance sheet recession to explain Japan’s lost decades of growth, offers a fresh angle on why US and Japanese voters have gone into “Throw the i… [+34124 chars]",2024-12-06T16:09:39Z,https://www.nakedcapitalism.com/2024/12/trump-tariffs-exchange-rates-and-the-strong-dollar-problem-the-message-of-elections-in-the-us-and-japan.html
trade wars,MSNBC,Zeeshan Aleem,Why Trump wants his convicted former trade adviser back at his side,Donald Trump's pick of Peter Navarro as an adviser on trade and manufacturing illustrates his desire for loyalty and economic nationalism.,"President-elect Donald Trump has picked his former trade adviser, Peter Navarro, to join his next administration as his Senior Counselor for Trade and Manufacturing. Compared to some of Trumps other … [+5658 chars]",2024-12-05T20:58:40Z,https://www.msnbc.com/opinion/msnbc-opinion/peter-navarro-trump-trade-tariffs-china-rcna182938
trade wars,PCWorld,Jared Newman,Confused about laptop CPU model names? Here’s a cheat sheet,"Want to go down a tech rabbit hole that’ll leave you utterly confused? Try understanding what processor you’re getting in a Windows laptop.




In their zeal to push AI as a selling point, Intel and AMD are renaming their laptop processors and tossing out th…","Skip to contentType your search and hit enter
When you purchase through links in our articles, we may earn a small commission. This doesn't affect our editorial independence
.
Want to go down a te… [+6771 chars]",2024-12-17T11:30:00Z,https://www.pcworld.com/article/2548392/confused-about-laptop-cpu-model-names-heres-a-cheat-sheet.html
