topic,source,author,title,description,content,published_at,url
freight rates,Business Insider,Emily Stewart,Trump wants to crack down on imports. Businesses are preparing for the worst.,"Consumers and businesses may have nowhere to hide from Trump's tariffs. So instead of waiting around, they're trying to get ahead of new import taxes.","anucha sirivisansuwan/Getty, Drew Angerer/Getty, Tyler Le/BI
In the days after the election, I caught myself doing some strange Googling. Mostly it was low-grade curiosity about the economic implica… [+9268 chars]",2024-11-24T09:09:02Z,https://www.businessinsider.com/trump-tariffs-what-to-buy-business-customers-anticipation-nervous-prices-2024-11
freight rates,Business Insider,Benjamin Zhang,"I drove a $63,000 Infiniti QX60. It's a stylish luxury SUV let down by its unrefined engine.","I drove a 2025 Infiniti QX60 luxury SUV in Luxe Black Edition trim and was impressed by its sleek design, quiet ride, and well-designed cabin.","The 2025 Infiniti QX60 Luxe Black Edition.Benjamin Zhang/Business Insider
<ul><li>The Infiniti QX60 is a midsize, three-row luxury SUV and the brand's best-selling model.</li><li>I was impressed by … [+7260 chars]",2024-12-16T19:49:39Z,https://www.businessinsider.com/infiniti-qx60-review-stylish-luxury-suv-spoiled-by-unrefined-engine-2024-12
freight rates,[Removed],,[Removed],[Removed],[Removed],2024-12-16T15:32:09Z,https://removed.com
freight rates,Forbes,"John Tamny, Contributor, 
 John Tamny, Contributor
 https://www.forbes.com/sites/johntamny/",DOGE’s Greater Potential Will Arguably Be Found In De-Regulation,Call the early railroads assembly lines on wheels.,"SAN BERNARDINO, CA - MAY 15: A freight train passes diagonally-shifted layers of earth as it ... [+] crosses the San Andreas Rift Zone, the system of depressions in the ground between the parallel fa… [+4927 chars]",2024-12-13T01:00:05Z,https://www.forbes.com/sites/johntamny/2024/12/12/doges-greater-potential-will-arguably-be-found-in-regulation/
freight rates,Yahoo Entertainment,"Zach Strickland, FW Market Expert & Market Analyst",Rising rejection rates amid demand drop reveal truckload capacity exodus,There is nuance in this freight market flip. Why is this transitioning truckload market unlike any other? The post Rising rejection rates amid demand drop...,"Photo: Jim Allen - FreightWaves
Chart of the Week: Contract Load Accepted Volume Index, Outbound Tender Volume Index USA SONAR: CLAV.USA, OTRI.USA
Carriers are accepting the same load volumes that … [+4877 chars]",2024-12-15T01:30:00Z,https://finance.yahoo.com/news/rising-rejection-rates-amid-demand-013000482.html
freight rates,CBS News,"Ash-har Quraishi, Amy Corral, Charlie Brooks, Matt Clark, Scott Pham, Jose Sanchez, Ryan Beard","Amazon trucking contractors have higher rates of safety violations, CBS News finds","Contracted truckers hauling packages between Amazon facilities are more likely to engage in dangerous behavior on the roads than other carriers, according to federal data analyzed by CBS News.",The death of a 19-year-old college student on a Texas highway is raising questions about the fleet of drivers Amazon uses to move packages between its facilities. College freshman Iliana Velez's life… [+8883 chars],2024-12-03T01:06:40Z,https://www.cbsnews.com/news/amazon-trucking-contractors-have-higher-rates-of-safety-violations/
freight rates,Yahoo Entertainment,"Craig Fuller, CEO at FreightWaves",Carrier Revenge: The freight market’s impending power shift,"In the ever-evolving landscape of the freight industry, a new phenomenon is emerging that threatens to upend the delicate balance between shippers and...","Signs of market recovery could me different dynamics on who holds the power in pricing. (Photo: Jim Allen/FreightWaves)
In the ever-evolving landscape of the freight industry, a new phenomenon is em… [+4212 chars]",2024-12-13T22:39:52Z,https://finance.yahoo.com/news/carrier-revenge-freight-market-impending-223952016.html
freight rates,Yahoo Entertainment,Saqib Iqbal Ahmed,Analysis-Strong momentum makes it hard to bet against ‘freight train’ US stock rally,"A relentless rally in U.S. stocks is showing few signs of slowing into year-end, even as rising valuations and signs of excessive speculation fuel worries...","By Saqib Iqbal Ahmed
NEW YORK (Reuters) - A relentless rally in U.S. stocks is showing few signs of slowing into year-end, even as rising valuations and signs of excessive speculation fuel worries t… [+4495 chars]",2024-12-09T06:03:19Z,https://finance.yahoo.com/news/analysis-strong-momentum-makes-hard-060319119.html
freight rates,Yahoo Entertainment,Todd Maiden,A stand-alone FedEx Freight gives LTL investors another pure play,A spinoff of FedEx Freight will give investors more options to play the less-than-truckload space. The post A stand-alone FedEx Freight gives LTL investors...,"FedEx is looking to cash in on the newfound love for LTL equities. (Photo: Jim Allen/FreightWaves)
Investors are getting more optionality when it comes to playing the less-than-truckload market. Fed… [+7424 chars]",2024-12-20T15:56:30Z,https://finance.yahoo.com/news/stand-alone-fedex-freight-gives-155630844.html
freight rates,Yahoo Entertainment,"Zach Strickland, FW Market Expert & Market Analyst",Will the maritime momentum continue in 2025?,Import demand has increased over the past two years as companies have largely corrected inventories and navigated treacherous waters in the maritime industry...,"Photo: Jim Allen - FreightWaves
Chart of the Week: Inbound Ocean TEUs Index, Customs TEUs Index USA SONAR: IOTI.USA, CSTEU.USA
U.S. container import demand is up more than 20% over where it was two… [+6012 chars]",2024-12-22T01:30:00Z,https://finance.yahoo.com/news/maritime-momentum-continue-2025-013000690.html
freight rates,International Business Times,AFP News,Lagarde Says ECB Will Continue To Cut Interest Rates,European Central Bank chief Christine Lagarde said Monday eurozone policymakers would keep cutting interest rates and warned that higher US tariffs under President-elect Donald Trump could hit growth in the bloc.,European Central Bank chief Christine Lagarde said Monday eurozone policymakers would keep cutting interest rates and warned that higher US tariffs under President-elect Donald Trump could hit growth… [+2117 chars],2024-12-16T10:15:20Z,https://www.ibtimes.com/lagarde-says-ecb-will-continue-cut-interest-rates-3755628
freight rates,Yahoo Entertainment,"Zach Strickland, FW Market Expert & Market Analyst",Reefer market tightens: Rising tender rejections signal shifting dynamics,Rising reefer tender rejection rates suggest the refrigerated truckload market is facing a tighter transportation procurement environment. The post Reefer...,"Photo: Jim Allen - FreightWaves
Chart of the Week: OReefer Outbound Tender Reject Index, Van Outbound Tender Reject Index USA SONAR: ROTRI.USA, VOTRI.USA
National refrigerated (reefer) tender rejec… [+5203 chars]",2024-12-08T01:30:00Z,https://finance.yahoo.com/news/reefer-market-tightens-rising-tender-013000191.html
freight rates,Forbes,"Trefis Team, Contributor, 
 Trefis Team, Contributor
 https://www.forbes.com/sites/greatspeculations/people/trefis/",Nike Stock Could Rise 2x If It Recovers To Pre-Inflation Shock Highs,"The company is scheduled to announce its second-quarter earnings on Thursday, 19th December.","WUHAN, CHINA - DECEMBER 05: Pedestrians walk past a Nike store featuring a modern design and ... [+] mannequins displaying winter apparel on December 5, 2024, in Wuhan, Hubei Province, China. As the … [+7129 chars]",2024-12-18T06:05:25Z,https://www.forbes.com/sites/greatspeculations/2024/12/18/nike-stock-could-rise-2x-if-it-recovers-to-pre-inflation-shock-highs/
freight rates,gcaptain.com,Lori Ann LaRocco,Nuance in Ocean Freight Rates Could Be Another Front-Loading Tea Leaf,Ocean freight rates have jumped up  for the December 15-31 bookings signaling a tightness of space due to demand.  Logistics managers tell gCaptain the special bullet rates have quickly disappeared the time being and the spot is heading up.,"By Lori Ann LaRocco (gCaptain)  
Ocean freight rates have jumped up for the December 15-31 bookings, signaling a tightness of space due to demand. Logistics managers tell gCaptain the special bullet… [+3108 chars]",2024-12-11T19:05:34Z,https://gcaptain.com/nuance-in-ocean-freight-rates-could-be-another-front-loading-tea-leaf/
freight rates,BusinessLine,TE Raja Simhan & V  Sajeev Kumar,Overhanging storm on the Red Sea,"Global trade disrupted by Red Sea attacks, forcing ships to avoid Suez Canal, impacting transit times and freight rates.","Its been a year since Houthi militants began attacking commercial ships in the Red Sea, leading to a major disruption in global trade. Commercial ships now largely avoid the Suez Canal the shortest s… [+4469 chars]",2024-12-01T14:23:00Z,https://www.thehindubusinessline.com/economy/logistics/overhanging-storm-on-the-red-sea/article68934547.ece
freight rates,gcaptain.com,Reuters,Hapag-Lloyd Expects Lower Profitability in Fourth Quarter,"Hapag-Lloyd expects lower profitability in the fourth quarter but still at a ""good level"", after freight rates peaked in the third quarter, Rolf Habben Jansen, the CEO of the German shipping company, said at a press conference on Monday.","Dec 2 (Reuters) – Hapag-Lloyd expects lower profitability in the fourth quarter but still at a “good level”, after freight rates peaked in the third quarter, Rolf Habben Jansen, the CEO of the German… [+1171 chars]",2024-12-02T16:21:08Z,https://gcaptain.com/hapag-lloyd-expects-lower-profitability-in-fourth-quarter/
freight rates,CBS News,Kate Gibson,"Amazon ignored warnings about worker injuries, Senate probe finds",E-commerce giant executives allegedly rejected safety recommendations urging production quotas be curtailed.,"Amazon knew of the link between increased worker injuries and the company's production quotas, but its executives allegedly rejected safety recommendations to loosen its mandates, an investigation by… [+2992 chars]",2024-12-16T19:01:17Z,https://www.cbsnews.com/news/amazon-worker-injuries-bernie-sanders-senate-probe/
freight rates,Yahoo Entertainment,STAN CHOE,Stock market today: Wall Street drifts toward the close of a dismal week,The S&P 500 edged down by 0.1% as its struggles continue after the Federal Reserve warned Wednesday it may deliver fewer cuts to interest rates next year...,"NEW YORK (AP) U.S. stocks are drifting Friday toward the close of one of their worst weeks of the year.
The S&amp;P 500 edged down by 0.1% as its struggles continue after the Federal Reserve warned … [+4113 chars]",2024-12-20T04:43:24Z,https://finance.yahoo.com/news/stock-market-today-asian-shares-044324049.html
freight rates,Practical Ecommerce,Armando Roggio,Temu’s U.S. Seller Program Is a DTC Opportunity,"DTC goods are unique and not sold by competing merchants. That’s the opportunity.
The post Temu’s U.S. Seller Program Is a DTC Opportunity appeared first on Practical Ecommerce.","Direct-to-consumer brands eager to find customers have an opportunity with Temu, China’s rapidly growing discount marketplace.
In February 2024, Temu launched a U.S. Seller Program, effectively open… [+3988 chars]",2024-12-19T23:11:41Z,https://www.practicalecommerce.com/temus-u-s-seller-program-is-a-dtc-opportunity
freight rates,Planetizen.com,Andreea Neculae,From 9-to-5 to Anytime: How Telecommuting Changes the Traffic Game,"From 9-to-5 to Anytime: How Telecommuting Changes the Traffic Game
Andreea Neculae
Tue, 12/10/2024 - 05:00



7 minutes","This article is adapted from a piece originally published on CoworkingCafe.
When millions began working from home, many of us thought, Finallya break from endless traffic jams. With WFH as the new n… [+9378 chars]",2024-12-10T13:00:00Z,https://www.planetizen.com/features/133110-9-5-anytime-how-telecommuting-changes-traffic-game
freight rates,Forbes,"Michael Harley, Contributor, 
 Michael Harley, Contributor
 https://www.forbes.com/sites/michaelharley/",Test Driving The 2025 Kia Carnival Hybrid,"If there is an award for the world’s best overall family vehicle, my money is on the 2025 Kia Carnival Hybrid MPV.","2025 Kia Carnival Hybrid HEV
©2024 Kia
If there is an award for the worlds best overall family vehicle, my money is on the 2025 Kia Carnival Hybrid MPV. The three-row Multi-Purpose Vehicle (lets no… [+7691 chars]",2024-12-05T22:51:51Z,https://www.forbes.com/sites/michaelharley/2024/12/05/test-driving-the-2025-kia-carnival-hybrid/
freight rates,OilPrice.com,Charles Kennedy,U.S. Oil Exports to Europe Set for January Dip,"Crude oil exports from the United States to Europe are set to dip next month amid a tightening spread between West Texas Intermediate and Brent, Reuters has reported, citing commodity analysts. U.S. oil exports to Europe hit an all-time high in November, at 7…","Qcells has set a world…
National Grid unveils a £35…
By Charles Kennedy - Dec 20, 2024, 3:00 AM CSTCrude oil exports from the United States to Europe are set to dip next month amid a tightening spr… [+1792 chars]",2024-12-20T09:00:00Z,https://oilprice.com/Latest-Energy-News/World-News/US-Oil-Exports-to-Europe-Set-for-January-Dip.html
freight rates,BusinessLine,V  Sajeev Kumar,Falling shipping rates to US-Europe sector bring cheers to shippers,"The drop in shipping rates attributes to many factors, the primary reason being the drop in cargo volumes from Far East to Europe and the US sectors",A significant drop in shipping rates especially in the US-Europe sector has brought some cheers to the exporters fraternity. But many believe that this has come up at the most inappropriate time when… [+2731 chars],2024-12-16T12:18:41Z,https://www.thehindubusinessline.com/economy/logistics/falling-shipping-rates-to-us-europe-sector-bring-cheers-to-shippers/article68991743.ece
freight rates,Symfony.com,Eloïse Charrier,"Case study - Upply: The PHP advantage: How we resisted the switch to Scala, rust, or go","After a pause, we’re excited to relaunch the publication of case studies in the Symfony community. Whether you’ve tackled challenging upgrades, solved complex technical issues, or transformed your team’s workflows, we want to hear from you! Share your experie…","After a pause, were excited to relaunch the publication of case studies in the Symfony community. Whether youve tackled challenging upgrades, solved complex technical issues, or transformed your team… [+12848 chars]",2024-12-18T07:00:00Z,https://symfony.com/blog/case-study-upply-the-php-advantage-how-we-resisted-the-switch-to-scala-rust-or-go?utm_source=Symfony%20Blog%20Feed&utm_medium=feed
freight rates,Bangkok Post,Phusadee Arunmas,Thai export performance improving steadily,"<p>Thai <strong>exports</strong> have performed better than expected this year, says the Thai National Shippers&rsquo; Council (TNSC), which expects 2024 forecasts to be upgraded as the year draws to a close.</p>","Thai exports have performed better than expected this year, says the Thai National Shippers’ Council (TNSC), which expects 2024 forecasts to be upgraded as the year draws to a close.
The group now e… [+2088 chars]",2024-12-03T10:40:00Z,https://www.bangkokpost.com/business/general/2913406/thai-export-performance-improving-steadily
freight rates,Biztoc.com,thestreet.com,Global shipping company files for Chapter 11 bankruptcy,"The shipping and logistics industry has faced the Great Freight Recession since about March 2022 with major companies filing for bankruptcies and some ceasing operations.
Some recent reports claimed that the freight recession might be ending with rising truck…",The shipping and logistics industry has faced the Great Freight Recession since about March 2022 with major companies filing for bankruptcies and some ceasing operations.Some recent reports claimed t… [+147 chars],2024-12-19T03:22:58Z,https://biztoc.com/x/939711d8be027816
freight rates,gcaptain.com,The Loadstar,Spot Rate Rollercoaster: Carriers Bank on GRIs Ahead of Lunar New Year,"Asia-Europe carriers saw their early December general rate increases (GRIs) stick this week, with spot rates into both North Europe and Mediterranean ports seeing double-digit increases.","By Gavin van Marle (The Loadstar) – 
Asia-Europe carriers saw their early December general rate increases (GRIs) stick this week, with spot rates into both North Europe and Mediterranean ports seein… [+2608 chars]",2024-12-06T15:50:01Z,https://gcaptain.com/spot-rate-rollercoaster-carriers-bank-on-gris-ahead-of-lunar-new-year/
freight rates,[Removed],,[Removed],[Removed],[Removed],2024-12-04T09:49:11Z,https://removed.com
freight rates,Yahoo Entertainment,Mashaid Ahmed,Is Uber Technologies (UBER) the Best Stock to Invest in for the Next 3 Months?,"We recently published a list of 12 Best Stocks to Invest in for the Next 3 Months. In this article, we are going to take a look at where Uber Technologies...","<ul><li>Morgan Stanley's Global Investment Committee advises investors to approach current market trends cautiously due to three primary risks: stretched equity valuations, ambitious corporate earnin… [+7726 chars]",2024-11-25T11:11:25Z,https://finance.yahoo.com/news/uber-technologies-uber-best-stock-111125289.html
freight rates,Biztoc.com,reuters.com,U.S. crude exports to Europe expected to fall in Jan as shipping economics weaken,"U.S. crude oil exports to northwest Europe are likely to slip early next year after hitting a record high in November, as the arbitrage for transatlantic shipments has slammed shut and freight rates have climbed, analysts said this week.","U.S. crude oil exports to northwest Europe are likely to slip early next year after hitting a record high in November, as the arbitrage for transatlantic shipments has slammed shut and freight rates … [+95 chars]",2024-12-19T23:23:33Z,https://biztoc.com/x/aad1e3616829429c
freight rates,Biztoc.com,finance.yahoo.com,Rising rejection rates amid demand drop reveal truckload capacity exodus,"Chart of the Week: Contract Load Accepted Volume Index, Outbound Tender Volume Index – USA SONAR: CLAV.USA, OTRI.USA
Carriers are accepting the same load volumes that they were in April 2023, near the theoretical floor of the freight market’s recent recession…","Chart of the Week: Contract Load Accepted Volume Index, Outbound Tender Volume Index USA SONAR: CLAV.USA, OTRI.USACarriers are accepting the same load volumes that they were in April 2023, near the t… [+146 chars]",2024-12-15T05:11:12Z,https://biztoc.com/x/f020d87dfb48e0ba
freight rates,Biztoc.com,ft.com,LNG freight rates plummet as sector grapples with glut of ships,Overproduction of vessels after 2022 energy crisis and delays to gas projects weigh on market to ship fuel,"Overproduction of vessels after 2022 energy crisis and delays to gas projects weigh on market to ship fuel
This story appeared on ft.com, 2024-12-14 13:00:22.",2024-12-14T13:59:51Z,https://biztoc.com/x/ff36177c7aed2d02
freight rates,Investing.com,Investing.com,"FedEx: Watch Q2 earnings for freight spinoff plans, big stock move, Stifel says","FedEx: Watch Q2 earnings for freight spinoff plans, big stock move, Stifel says","Investing.com-- Global logistics giant FedEx Corporation (NYSE:FDX) is set to report its quarterly earnings later this week, with analysts at Stifel predicting a sharp move in the stock, especially i… [+1277 chars]",2024-12-18T04:40:23Z,https://www.investing.com/news/stock-market-news/fedex-watch-q2-earnings-for-freight-spinoff-plans-big-stock-move-stifel-says-3778519
freight rates,Investing.com,Reuters,U.S. crude exports to Europe expected to fall in Jan as shipping economics weaken,U.S. crude exports to Europe expected to fall in Jan as shipping economics weaken,"By Georgina McCartney, Arathy Somasekhar and Enes Tunagur
HOUSTON/LONDON (Reuters) - U.S. crude oil exports to northwest Europe are likely to slip early next year after hitting a record high in Nove… [+2259 chars]",2024-12-19T23:15:49Z,https://www.investing.com/news/commodities-news/us-crude-exports-to-europe-expected-to-fall-in-jan-as-shipping-economics-weaken-3783477
freight rates,gcaptain.com,Mike Schuler,"Maersk: Lunar New Year, Labor Disputes, and Port Congestion Challenge European Shipping Market in 2025","The early months of 2025 will present unique challenges and opportunities for the shipping industry. The Lunar New Year, beginning January 29, 2025, is expected to impact global shipping patterns,...","The early months of 2025 will present unique challenges and opportunities for the shipping industry.
The Lunar New Year, beginning January 29, 2025, is expected to impact global shipping patterns, t… [+3230 chars]",2024-12-09T20:54:50Z,https://gcaptain.com/maersk-lunar-new-year-labor-disputes-and-port-congestion-challenge-european-shipping-market-in-2025/
freight rates,Biztoc.com,cnbc.com,The shipping industry is wrestling with one of its largest challenges,"The shipping industry is contending with a worldwide shortage of seafarers, and it's fueling a troubling mix of fake resumes, accidents at sea, and elevated freight rates.
""We have been seeing a consistent shortage of seafarers,"" Rhett Harris, senior manning …","The shipping industry is contending with a worldwide shortage of seafarers, and it's fueling a troubling mix of fake resumes, accidents at sea, and elevated freight rates.""We have been seeing a consi… [+142 chars]",2024-11-26T23:53:34Z,https://biztoc.com/x/eb07fa58bd66f105
freight rates,EURACTIV,Georgi Gotev,Trump wants EU to buy more US oil and gas or face tariffs,"Trump said Europe would pay a heavy price for having run a large trade surplus with the US for decades.
The post Trump wants EU to buy more US oil and gas or face tariffs appeared first on Euractiv.",US President-elect Donald Trump said on Friday (20 December) that the European Union may face tariffs if the bloc does not cut its growing deficit with the United States by making large oil and gas t… [+2357 chars],2024-12-20T09:25:19Z,https://www.euractiv.com/section/eet/news/trump-wants-eu-to-buy-more-us-oil-and-gas-or-face-tariffs/
freight rates,Europa.eu,European Central Bank,"Christine Lagarde, Luis de Guindos: Monetary policy statement",The European Central Bank (ECB) is the central bank of the European Union countries which have adopted the euro. Our main task is to maintain price stability in the euro area and so preserve the purchasing power of the single currency.,"Christine Lagarde, President of the ECB,Luis de Guindos, Vice-President of the ECB
Frankfurt am Main, 12 December 2024 
Good afternoon, the Vice-President and I welcome you to our press conference.… [+10957 chars]",2024-12-12T14:00:00Z,https://www.ecb.europa.eu/press/press_conference/monetary-policy-statement/2024/html/ecb.is241212~ce143b3bc8.en.html
freight rates,Investing.com,Reuters,Analysis-Strong momentum makes it hard to bet against ‘freight train’ US stock rally,Analysis-Strong momentum makes it hard to bet against ‘freight train’ US stock rally,"By Saqib Iqbal Ahmed
NEW YORK (Reuters) - A relentless rally in U.S. stocks is showing few signs of slowing into year-end, even as rising valuations and signs of excessive speculation fuel worries t… [+4450 chars]",2024-12-09T06:05:39Z,https://www.investing.com/news/stock-market-news/analysisstrong-momentum-makes-it-hard-to-bet-against-freight-train-us-stock-rally-3760482
freight rates,Digital Journal,AFP,Lagarde says ECB will continue to cut interest rates,"European Central Bank chief Christine Lagarde said Monday eurozone policymakers would keep cutting interest rates and warned that higher US tariffs under President-elect Donald Trump could hit growth in the bloc. “Even though we are not there yet, we are clos…","European Central Bank President Christine Lagarde said eurozone growth 'is likely to take a hit' if the United States goes into protectionism mode - Copyright AFP Adrian DENNIS
European Central Bank… [+2297 chars]",2024-12-16T11:52:32Z,https://www.digitaljournal.com/world/lagarde-says-ecb-will-continue-to-cut-interest-rates/article
freight rates,Overdriveonline.com,Alex Lockie,Transparency enforcement could squeeze brokers' margins: Analyst,This freight watcher thinks increased freight transparency is likely to squeeze brokers' margins from both sides. Whether it comes out in favor of carriers or shippers could depend on the market.,"If every broker on every load had to tell both the shipper and the carrier the buy and sell price on each load, what would happen? Nobody knows exactly, but for owner-operators engaged in the broker … [+6754 chars]",2024-12-18T08:44:06Z,https://www.overdriveonline.com/regulations/article/15710638/would-transparency-put-the-squeeze-on-broker-margins
freight rates,[Removed],,[Removed],[Removed],[Removed],2024-11-26T23:51:40Z,https://removed.com
freight rates,Yahoo Entertainment,Noi Mahoney,Borderlands Mexico: Cyberattacks rise in Mexico as cross-border trade grows,This week in Borderlands: Cyberattacks rise in Mexico as cross-border trade grows; California begins construction of second Otay Mesa border port of entry...,"Yahoo is using AI to generate takeaways from this article. This means the info may not always match what's in the article. Reporting mistakes helps us improve the experience.Generate Key Takeaways
B… [+6481 chars]",2024-12-15T12:00:00Z,https://www.yahoo.com/news/borderlands-mexico-cyberattacks-rise-mexico-120000395.html
